code,review,top_1,top_2,top_3,top_4,top_5,top_6,top_7,top_8,top_9,top_10
"@@ -178,9 +178,13 @@ class PickDropChannelsMixin(object): inst = self.copy() if copy else self idx = [inst.ch_names.index(c) for c in ch_names if c in inst.ch_names] + if hasattr(inst, 'picks'): inst.picks = [inst.picks[k] for k in idx] + if hasattr(inst, 'cals'): + inst.cals = inst.cals[idx] + inst.info = pick_info(inst.info, idx, copy=False) my_get = lambda attr: getattr(inst, attr, None) ",@agramfort I like this better since it's a separate issue from preloading. WDYT? cc @dengemann,@agramfort I like this better since it's a separate issue from preloading. WDYT? cc @dengemann,~~What's a repo import?~~ Got it.,"I can understand the sequence size being configurable when you're using the dummy decoder, but does it make sense to override it when using a real decoder? IMO, the code should only allow the `--seq` option to be set when `-m_de` is unspecified, and otherwise derive the sequence size from the decoder's input shape.","If you remove `visit_mypy_file` from the class (I think that it's unused), this will be completely reasonable, since this will be reference to something outside the AST node we are transforming.",Would `elif x is None` work?,"You'll also need to add this to `predict_entailment` in the model, I think.","Let's throw a generic ``ConanException``. New exceptions will be introduced from now on, only if it is going to be captured and processed somewhere else. Let's keep it simple.",This will throw a warning since the `exclude` parameter is not set. Might be saner to do `exclude='bads'` then omit from the next line.,"Could this be breaking? I think it shouldn't, the aggregated_components is used only by the new generators, and it makes sense that aggregating the components in a single cppinfo, keeps the root properties. The aggregation cannot be done for the component's properties because they cannot be aggregated but keeping the root one make sense. right?","Why not Optional? (Currently mypy ignores the None initialization but we may change that, and it seems to me this function can definitely return with `id_mapper` still None."
"@@ -52,9 +52,8 @@ class DataIterator: @classmethod def from_params(cls, params: Params): - from allennlp.experiments.registry import Registry # TODO(Mark): The adaptive iterator will need a bit of work here, # to retrieve the scaling function etc. - iterator_type = params.pop_choice(type, Registry.list_data_iterators()) - return Registry.get_data_iterator(iterator_type)(**params.as_dict()) # type: ignore + iterator_type = params.pop_choice(type, cls.list_available()) + return cls.by_name(iterator_type)(**params.as_dict()) # type: ignore ","Do we actually need the `# type: ignore` here? We don't have it in other places. Also, there is no listed return type for the method - maybe that's the reason there was a type failure?","Do we actually need the `# type: ignore` here? We don't have it in other places. Also, there is no listed return type for the method - maybe that's the reason there was a type failure?",use lower case? `Type` -> `type`,Why no type annotations here?,"For the record: this is a bit ugly, but it will turn into a cleaner and more proper `fs.get_file` when migrating dvcfs to fsspec.","Create a new `PipelineHelper` to do compile, which could inherited from `CollectiveHelper`. As `PipelineHelper` is specific for pipeline, it could be put into corresponding meta optimizer.",I'm not sure I like the name of this key here...,"A problem with inserting new arguments is that it breaks backwards compatibility in cases where people call the function with non keyword arguments (`read_raw_kit(input_fname, mrk, elp, ...)`). Before making this change we should be sure that nobody is using this function in their scripts that way. Otherwise the safer alternative is to add new arguments at the end.",We should probably fork the CentOS include into two as as well - the newest (CentOS 8) has Apache version 2.4.35 that supports TLS session tickets. We could probably just call the ancestor class with `centos-old` and `centos-current` prefixes.,"Perhaps instead of adding a new call for is_thrift, this could move to a different pattern. Maybe it could look for the class instead via isinstance. It looks like the deprecation plan for the associated `is_*` methods involved types via marker mixins.",I think this can be done via `get_language_info` `i18n` templatetag
"@@ -429,6 +429,11 @@ static int def_load_bio(CONF *conf, BIO *in, long *line) if (!str_copy(conf, psection, &include, p)) goto err; + if (conf->flag_abspath && !ossl_is_absolute_path(include)) { + ERR_raise(ERR_LIB_CONF, CONF_R_RELATIVE_PATH); + goto err; + } + if (include_dir != NULL && !ossl_is_absolute_path(include)) { size_t newlen = strlen(include_dir) + strlen(include) + 2; ",I'd recommend considering semantics that enforces the absolute path check only after prepending the include_dir. IMO it would be much more useful.,I'd recommend considering semantics that enforces the absolute path check only after prepending the include_dir. IMO it would be much more useful.,"sizeof() is number of bytes in memory, not number of characters in the string string += int is appending the character value of the integer","Instead of `vpm->purpose != X509_PURPOSE_SSL_SERVER` it would have to be `vpm->purpose == X509_PURPOSE_SSL_CLIENT`. Otherwise, this breaks `X509_PURPOSE_SMIME_SIGN` and possibly others.","This is very dodgy. One alias to the HMAC signature algorithm and the test may randomly go **BAMF**, because you might end up with, oh I don't know, id-Hmac. This is a case where the application has more accurate knowledge than libcrypto, as it really has *all* the data it needs to know exactly what names it's asking for. It's quite a simple program after all...","It's really hard to follow this, why don't you just simply allocate per-RDG used domain bitmap for all groups at the very beginning (Just like what we did for other bitmaps)?","Is it redundant or any side-effect? As my understand, if the caller offer the @args parameter, then it needs to free the space (pointed by rec->rec_mmid) by itself. The @rec will be freed after ik_rec_free() returned. So whether reset the rec_mmid or not will not cause correctness issue, right?",seems this loop is a good canditate to be replaced with a for loop,Should this be configurable? i.e on by default but able to be turned off.. Should it be able to be disabled at compile time? I had to do similar things for #12745,mismerge? this seems to be duplicate.,This matches the pattern from the recent change to lib/Runtime/Library/BoundFunction.cpp
"@@ -83,9 +83,6 @@ func testAPIDeleteOAuth2Application(t *testing.T) { oldApp := models.AssertExistsAndLoadBean(t, &models.OAuth2Application{ UID: user.ID, Name: test-app-1, - RedirectURIs: []string{ - http://www.google.com, - }, }).(*models.OAuth2Application) urlStr := fmt.Sprintf(/api/v1/user/applications/oauth2/%d?token=%s, oldApp.ID, token) ",reason to remove this?,reason to remove this?,What the heck is a LUT?  ,I'm not in love with instantiating `challengeTLSProvider` & `challengeHTTPProvider` here.,We could put this string in a central place somewhere so we can reference it in both places where it appears in the code here in this PR.,@smarterclayton should this inform the routing config subdomain or leave that default as is?,"Should we have utility functions that delineate which non-successful BuildPhases are set by the build pod (where it is *currently* just Failed) and which are set outside of the build pod (i.e. BuildPhaseError), in case those two lists change over time?","@rhatdan question, does the first docker here need to be capped?",I was intentional to return `storeID` instead of `peer` to avoid alloc too many IDs during replacement check.,"If ProjectRequestTemplate is required, shouldn't you throw an error if it's absent?",I assume that there's some hidden invariant here that `data.outputSteps[0]` is correct. Should we be asserting something about `step.Op` at this point? Would it make more sense to write the above as a range like we have for Create/Replace?
"@@ -1,9 +1,16 @@ import logging +from dvc.exceptions import InvalidArgumentError + logger = logging.getLogger(__name__) def _update_import_on_remote(stage, remote, jobs): + if stage.is_repo_import: + raise InvalidArgumentError( + Can't update a repo import with --to-remote + ) + url = stage.deps[0].path_info.url stage.outs[0].hash_info = stage.repo.cloud.transfer( url, jobs=jobs, remote=remote, command=update ",~~What's a repo import?~~ Got it.,~~What's a repo import?~~ Got it.,@agramfort I like this better since it's a separate issue from preloading. WDYT? cc @dengemann,"Do you check path representation, when you print it? If I not mistaken, it will be printed like PosixPath('path')","If you remove `visit_mypy_file` from the class (I think that it's unused), this will be completely reasonable, since this will be reference to something outside the AST node we are transforming.",You missed a space. Also you can use `f'strings'` if you want!,"Could this be breaking? I think it shouldn't, the aggregated_components is used only by the new generators, and it makes sense that aggregating the components in a single cppinfo, keeps the root properties. The aggregation cannot be done for the component's properties because they cannot be aggregated but keeping the root one make sense. right?","Let's throw a generic ``ConanException``. New exceptions will be introduced from now on, only if it is going to be captured and processed somewhere else. Let's keep it simple.","So, this works, but we should take a look at how it is being used, and see whether it should be batched. The parsing will be memoized obviously, but each usage is O(N) in the number of targets in a directory.",This should really be a defined constant.,"For the record: this is a bit ugly, but it will turn into a cleaner and more proper `fs.get_file` when migrating dvcfs to fsspec."
"@@ -175,12 +175,16 @@ func determineSeed(shoot *gardencorev1beta1.Shoot, seedLister gardencorelisters. return nil, err } - filteredSeeds, err := filterSeedsMatchingSeedSelector(cloudProfile, seedList) + seedsMatchingCloudProfileSelector, err := filterSeedsMatchingSeedSelector(seedList, cloudProfile.Spec.SeedSelector, CloudProfile) + if err != nil { + return nil, err + } + seedsMatchingShootSelector, err := filterSeedsMatchingSeedSelector(seedsMatchingCloudProfileSelector, shoot.Spec.SeedSelector, Shoot) if err != nil { return nil, err } - candidates, err := getCandidates(shoot, filteredSeeds, strategy) + candidates, err := getCandidates(shoot, seedsMatchingShootSelector, strategy) if err != nil { return nil, err } ","Hmm, this will yield an unhelpful message, if there are Seeds that are matching the `seedSelector` of the Shoot, but not the one of the CloudProfile. I.e. it will say none out of the <n> seeds has the matching labels required by seed selector of 'Shoot' although, all Seeds might actually match the Shoot's selector. Can you evaluate both selectors individually and then combine the filtered set of Seeds here to be able to give a more helpful error message?","Hmm, this will yield an unhelpful message, if there are Seeds that are matching the `seedSelector` of the Shoot, but not the one of the CloudProfile. I.e. it will say none out of the <n> seeds has the matching labels required by seed selector of 'Shoot' although, all Seeds might actually match the Shoot's selector. Can you evaluate both selectors individually and then combine the filtered set of Seeds here to be able to give a more helpful error message?",I think a better place for this would be inside of `broadcaster#Start()`,we already implement `String` on proxyURL. No need to change that line.,I was intentional to return `storeID` instead of `peer` to avoid alloc too many IDs during replacement check.,@smarterclayton should this inform the routing config subdomain or leave that default as is?,"@rhatdan question, does the first docker here need to be capped?","@CecileRobertMichon do you have any thoughts on doing this override here? Is this preferable to the pattern we have currently, where we pass along upgrade context through the code flow and do upgrade-specific mutations during defaults enforcement?",This sort of mistake might be best avoided by encapsulating this logic in one place,What the heck is a LUT?  ,"- As discussed have added type `chef-server` but it subject to change. - At present, it's required to add validation for admin `key` only."
"@@ -741,7 +741,17 @@ static int check_id(X509_STORE_CTX *ctx) if (!check_id_error(ctx, X509_V_ERR_IP_ADDRESS_MISMATCH)) return 0; } - return 1; + + /* + * When verifying SSL server certificates, require that an + * identity be set for validating the certificate subject unless + * the X509_V_FLAG_ALLOW_NO_SUBJECT_CHECK flags is set instead. + */ + if (vpm->purpose != X509_PURPOSE_SSL_SERVER + || (vpm->flags & X509_V_FLAG_ALLOW_NO_SUBJECT_CHECK)) + return 1; + + return (vpm->hosts || vpm->email || vpm->ip); } static int check_trust(X509_STORE_CTX *ctx, int num_untrusted) ","Instead of `vpm->purpose != X509_PURPOSE_SSL_SERVER` it would have to be `vpm->purpose == X509_PURPOSE_SSL_CLIENT`. Otherwise, this breaks `X509_PURPOSE_SMIME_SIGN` and possibly others.","Instead of `vpm->purpose != X509_PURPOSE_SSL_SERVER` it would have to be `vpm->purpose == X509_PURPOSE_SSL_CLIENT`. Otherwise, this breaks `X509_PURPOSE_SMIME_SIGN` and possibly others.","sizeof() is number of bytes in memory, not number of characters in the string string += int is appending the character value of the integer",I'd recommend considering semantics that enforces the absolute path check only after prepending the include_dir. IMO it would be much more useful.,"This is very dodgy. One alias to the HMAC signature algorithm and the test may randomly go **BAMF**, because you might end up with, oh I don't know, id-Hmac. This is a case where the application has more accurate knowledge than libcrypto, as it really has *all* the data it needs to know exactly what names it's asking for. It's quite a simple program after all...",Should this be configurable? i.e on by default but able to be turned off.. Should it be able to be disabled at compile time? I had to do similar things for #12745,This matches the pattern from the recent change to lib/Runtime/Library/BoundFunction.cpp,idToken is used in getLogoutInformation method,This should probably just create a mask and do a single comparison rather than loop over individual bits.,SHA1 is non FIPS_MODE here but in FIPS_MODE in rsa_aid.c. Why?,"It's really hard to follow this, why don't you just simply allocate per-RDG used domain bitmap for all groups at the very beginning (Just like what we did for other bitmaps)?"
"@@ -236,6 +236,7 @@ func (b *BleveIndexer) Search(keyword string, repoIDs []int64, limit, start int) for _, repoID := range repoIDs { repoQueriesP = append(repoQueriesP, numericEqualityQuery(repoID, RepoID)) } + index, _ := strconv.ParseInt(keyword, 10, 64) repoQueries := make([]query.Query, len(repoQueriesP)) for i, v := range repoQueriesP { repoQueries[i] = query.Query(v) ",Maybe keyword is a string?,Maybe keyword is a string?,What the heck is a LUT?  ,I assume that there's some hidden invariant here that `data.outputSteps[0]` is correct. Should we be asserting something about `step.Op` at this point? Would it make more sense to write the above as a range like we have for Create/Replace?,I was intentional to return `storeID` instead of `peer` to avoid alloc too many IDs during replacement check.,I think a better place for this would be inside of `broadcaster#Start()`,"Hmm, this will yield an unhelpful message, if there are Seeds that are matching the `seedSelector` of the Shoot, but not the one of the CloudProfile. I.e. it will say none out of the <n> seeds has the matching labels required by seed selector of 'Shoot' although, all Seeds might actually match the Shoot's selector. Can you evaluate both selectors individually and then combine the filtered set of Seeds here to be able to give a more helpful error message?","There's only one set of `mapByResourceAndAction` and `methodsInfo`, so they're no longer passed in, but retrieved in the introspection code.",This log line was added by me. I think it won't hurt but it simplifies a debugging process.,nit: `firehoseLogHandler` vs. `firehoseMiddleware` looks like a naming inconsistency? (`log` is not used anywhere else).,"- As discussed have added type `chef-server` but it subject to change. - At present, it's required to add validation for admin `key` only."
"@@ -329,13 +329,10 @@ func (a *apiServer) upsertWorkersForPipeline(pipelineInfo *pps.PipelineInfo) err workerRc, err := rc.Get( ppsutil.PipelineRcName(pipelineInfo.Pipeline.Name, pipelineInfo.Version), metav1.GetOptions{}) - if err == nil { - if (workerRc.Spec.Template.Spec.Containers[0].Resources.Requests == nil) && *workerRc.Spec.Replicas == 1 { - parallelism = 1 - resourceRequests = nil - resourceLimits = nil - } + if err != nil { + log.Errorf(error from rc.Get: %v, err) } + // TODO figure out why the statement below runs even if there's an error // rc was made by a previous version of pachyderm so we delete it if workerRc.ObjectMeta.Labels[version] != version.PrettyVersion() { if err := a.deleteWorkersForPipeline(pipelineInfo); err != nil { ",Shouldn't we be returning the error if there is an error here? I noticed you have a todo below to find out why the statement below is running when there is an error.,Shouldn't we be returning the error if there is an error here? I noticed you have a todo below to find out why the statement below is running when there is an error.,This log line was added by me. I think it won't hurt but it simplifies a debugging process.,pre-existing bug. We should split this function into `maybeStale` and `active` like in user_ek -- the `getServerMaxDeviceEK` is busted if the latest key is stale.,All or most of this deletion was related to generating the per-language API doc link for each object type.,not needed because it's not a pointer on a slice.,"There's only one set of `mapByResourceAndAction` and `methodsInfo`, so they're no longer passed in, but retrieved in the introspection code.",nit: `firehoseLogHandler` vs. `firehoseMiddleware` looks like a naming inconsistency? (`log` is not used anywhere else).,"@CecileRobertMichon do you have any thoughts on doing this override here? Is this preferable to the pattern we have currently, where we pass along upgrade context through the code flow and do upgrade-specific mutations during defaults enforcement?","I see, the provider-level region skips the field validation. May be add a mention about this here?",why doesn't this try calling t.getAdminPermission()?
"@@ -1018,8 +1018,17 @@ def while_loop(cond, body, loop_vars, is_test=False, name=None): return loop_vars while_loop_block = While(pre_cond, is_test, name) + with_mutable_vars = assert_with_mutable_vars(loop_vars) with while_loop_block.block(): - output_vars = body(*loop_vars) + # If a variable with mutable type is included in vars, like `dict/list`, + # modifying them in the body function will cause origin variable be modified + # synchronously. This will raise an assignment error out of while block. + # Here we make a copy of the mutable object to aviod this problem. + if with_mutable_vars: + new_loop_vars = copy_mutable_vars(loop_vars) + output_vars = body(*new_loop_vars) + else: + output_vars = body(*loop_vars) if not isinstance(output_vars, (list, tuple)): output_vars = [output_vars] if len(output_vars) != len(loop_vars): ",Grammatical error: cause origin variable be modified to cause origin variable to be modified,Grammatical error: cause origin variable be modified to cause origin variable to be modified,"If you remove `visit_mypy_file` from the class (I think that it's unused), this will be completely reasonable, since this will be reference to something outside the AST node we are transforming.",Hmm... Refactor this to merge with the nearly identical block in the previous method?,lowpass is always present but it can be None. I think you will warn all the time here. What I would do is something like this: `if raw.info.get('lowpass') and raw.info['lowpass'] < 'lowpass' `,Does this test work for you? It fails here.,"So, this works, but we should take a look at how it is being used, and see whether it should be batched. The parsing will be memoized obviously, but each usage is O(N) in the number of targets in a directory.",Maybe create a temporary for the outputs and subsequently unpack? The braces around the function call seems strange.,"I don't see how this branch can ever be entered - when this condition is true, the condition of the branch above will be true, and this won't get entered.",we never use np.testing outside of tests. Also shape are tuples so == works fine.,~~What's a repo import?~~ Got it.
"@@ -39,11 +39,12 @@ KRATOS_CREATE_3D_VARIABLE_WITH_COMPONENTS(COARSE_VELOCITY) KRATOS_CREATE_VARIABLE(double,FIC_BETA) // Adjoint variables -KRATOS_CREATE_3D_VARIABLE_WITH_COMPONENTS(ADJOINT_FLUID_VECTOR_1) -KRATOS_CREATE_3D_VARIABLE_WITH_COMPONENTS(ADJOINT_FLUID_VECTOR_2) -KRATOS_CREATE_3D_VARIABLE_WITH_COMPONENTS(ADJOINT_FLUID_VECTOR_3) KRATOS_CREATE_3D_VARIABLE_WITH_COMPONENTS(AUX_ADJOINT_FLUID_VECTOR_1) +KRATOS_CREATE_3D_VARIABLE_WITH_COMPONENTS_WITH_TIME_DERIVATIVE(ADJOINT_FLUID_VECTOR_3, AUX_ADJOINT_FLUID_VECTOR_1); +KRATOS_CREATE_3D_VARIABLE_WITH_COMPONENTS_WITH_TIME_DERIVATIVE(ADJOINT_FLUID_VECTOR_2, ADJOINT_FLUID_VECTOR_3); +KRATOS_CREATE_3D_VARIABLE_WITH_COMPONENTS_WITH_TIME_DERIVATIVE(ADJOINT_FLUID_VECTOR_1, ADJOINT_FLUID_VECTOR_2); KRATOS_CREATE_VARIABLE(double, ADJOINT_FLUID_SCALAR_1) +KRATOS_CREATE_VARIABLE(Vector, PRIMAL_RELAXED_SECOND_DERIVATIVE_VALUES) // Non-Newtonian constitutive relations KRATOS_CREATE_VARIABLE(double, REGULARIZATION_COEFFICIENT) ",mmm... are these time derivatives?,mmm... are these time derivatives?,"why `+0.8`? shouldn't it always be lower? i.e., `np.abs(stc_normal.data) <= stc.data` should hold","Nice catch, can we fix the indentation ? And there is another PR same with this, can we close that ?","You can remove these too. Below do: `var northEast = projection.project(cart, viewExtentCVNorthEast);` and remove `position`. Same thing for `southWest`.",Are we sure that this will not return any forbidden characters for the path file?,(style) line over 80 characters,"I don't see how this branch can ever be entered - when this condition is true, the condition of the branch above will be true, and this won't get entered.",I wonder if this should really be an octet_string instead of an octet_ptr?,"This configures Jackson to exclude `null`, `Optional.empty()` and empty collections when serializing.",just to check would: sum([_unpack_epochs(epoch) for epoch in epochs]) work too?
"@@ -1,12 +1,15 @@ // Licensed to the .NET Foundation under one or more agreements. // The .NET Foundation licenses this file to you under the MIT license. +using System; + namespace System.Configuration { public enum SettingsSerializeAs { String = 0, Xml = 1, + [Obsolete(Obsoletions.BinaryFormatterMessage + @. Consider using Xml instead., false)] Binary = 2, ProviderSpecific = 3 } ",This is a change to public surface area. I would have expected the ref to also be updated with this.,This is a change to public surface area. I would have expected the ref to also be updated with this.,I assume you're checking with XNA and these are cases where we missed having it serializable? Can you add `[DataContract]` to these as well if that is the case?,What is unsafe about the two methods below? Can these suppressions (and thus the RUC on the ctor) be removed on this class?,Another reason this has to be this way is that we have to run on kube directly - we should make a note somewhere that it's illegal to reference a kube registry from an openshift storage object.,"it would be better if we give it a big enough initial size, such as `(int) (methods.size() / 0.75f) + 1`","What type is `NumberHandling`? Isn't it an enum value, how can it be null?","Note that `GetPropertyName` is marked with `AggressiveInline` but `LookupProperty` is not (it used to be, but there became 4 references to it over time causing code bloat).",This matches the pattern from the recent change to lib/Runtime/Library/BoundFunction.cpp,"Do either LocalName or NamespaceURI have side-effects, e.g. advancing the reader, throwing exceptions if something couldn't be parsed, etc.?",@mjkkirschner is this an API break too?
