code,review,top_1,top_2,top_3,top_4,top_5,top_6,top_7,top_8,top_9,top_10
"public static void main(String[] args) throws Exception { Optional.ofNullable(System.getProperty(""logback.configurationFile"")) .stream() .forEach(file -> System.err.println(""Load logging config from "" + file)); Configuration configuration = Configuration.builder() .useWorkingDirectoryEnvProperty() .build(); LOGGER.info(""Loading configuration {}"", configuration); GuiceJamesServer server = createServer(configuration) .combineWith(new JMXServerModule()); JamesServerMain.main(server); }",Can't we rely on System.out here because as far as I know we are not printing an error but an expected behavior.,style nit: no braces around single line,Is this test really testing much? It doesn't assert that the result is not a failure: !(result instanceof Failed) for instance.,Style-nit: Unnecessary blank line.,Can we add an actual exception message if we ever run into this issue in production.,the constructor already asserts that,Prefer ActionParameters.getRequiredParamLong(PARAM_ID) instead. If the id is not a long we don't want to fail with ActionDeniedException but with a ActionParamsExcepton instead.,instead you could use the try-with-resource paradigm,"We don't need this check. Even if ""?"" is used somewhere, which I doubt, UnknownEnvironmentException be self-exlanatory enough for somebody to investigate and fix it.","prevShip.ini shouldn't be used here, now that you have the constant defined. In fact, I don't think the file should be passed to the save manager, as that's more of a save manager concern. I would consider moving all of this logic into the hasPrevShip function.",This string should go into the messages.properties file.
"public String createNewProcess() { try { createProcessHierarchy(); if (Objects.nonNull(PrimeFaces.current())) { PrimeFaces.current().executeScript(""PF('sticky-notifications').renderMessage({'summary':'"" + Helper.getTranslation(""processSaving"") + ""','detail':'"" + Helper.getTranslation( ""youWillBeRedirected"") + ""','severity':'info'});""); } return processListPath; } catch (DataException e) { Helper.setErrorMessage(""errorSaving"", new Object[] {ObjectType.PROCESS.getTranslationSingular() }, logger, e); } catch (IOException | ProcessGenerationException e) { logger.error(e.getLocalizedMessage()); } return this.stayOnCurrentPage; }",suggestion if (Objects.nonNull(PrimeFaces.current()) && Objects.nonNull(FacesContext.getCurrentInstance()) {,This logic changes a bit due to <LINK_0>,All the above tests are already covered by the BaseComputeServiceLiveTest. You should subclass that one and try to make all tests pass without overriding its methods (as that is our compute service implementation contract). Take the [DigitalOcean](<LINK_0> one as an example.,Style-nit: Unnecessary blank line.,Is that a software issue? Then better do WARN and include the exception as a last param.,"assertNotNull(""No WINDIR value returned"", winDir); assertTrue(""Specified WINDIR does not exist: "" + winDir, new File(winDir).exists());",Superfluous check I think-it has been a long time since Executors were reused.,style nit: no braces around single line,Prefer ActionParameters.getRequiredParamLong(PARAM_ID) instead. If the id is not a long we don't want to fail with ActionDeniedException but with a ActionParamsExcepton instead.,don't you want to add a/b?,"this code is very strange, can you explain to me because is necessary?"
"private static void appendLib(StringBuilder classpath, String libDirName, boolean useLibJarsFormat) { File libDir = new File(libDirName); if (!libDir.exists()) { System.err.println(""ERROR - Directory needed for classpath does not exist: "" + libDirName); System.exit(-1); } if (useLibJarsFormat) { File[] files = libDir.listFiles(); Arrays.sort(files); for (File f : files) { if (f.isFile() && f.getName().endsWith("".jar"")) { if (classpath.length() != 0) { classpath.append("",""); } classpath.append(f.getAbsolutePath()); } } } else { if (classpath.length() != 0) { classpath.append("":""); } classpath.append(libDir + ""/*""); } }",Should this be libDir.getAbsolutePath() like f..getAbsolutePath() above?,Put this snippet of getting alterationNames into a function. Since the same code is used in printEvidences(),This logic changes a bit due to <LINK_0>,can just do if (StringUtils.isBlank(id)) { return; } to reduce nesting level,Style-nit: Unnecessary blank line.,Likewise.,"Like I mentioned to others, try-catch-fail is not a good option. JUnit automatically populates exception to user and fails the test. If exception occurs, user will now get a bland message and not the stack trace of the problem. There is nothing we can assert here?",you should use res.isWorseThan(Result.SUCCESS) instead. <LINK_0>,iirc the source is added later in the controller and not part of the request.,Do you think it's worthwhile to check !targetAccountName.isEmpty() as well? Same for container's check.,"use an overload or varargs to make this parameter optional, so: 1- you don't break current API 2- don't force the user to think about this parameter (especially in the context of non sync)"
"public boolean close() { synchronized (startStopLock) { if (!started.get() || executorService.isShutdown()) { LOG.info(""Already shutdown, ignoring""); return false; } started.set(false); executorService.shutdownNow(); final ListenableFuture<?> future = this.future; if (future != null) { if (!future.isDone() && !future.cancel(true) && !future.isDone()) { LOG.error(""Error cancelling future for topic [%s]"", getKafkaTopic()); return false; } } if (!cacheManager.delete(factoryId)) { LOG.error(""Error removing [%s] for topic [%s] from cache"", factoryId, getKafkaTopic()); return false; } if (consumerConnector != null) { consumerConnector.shutdown(); } return true; } }",calling stop multiple times should return true thought,can we use a CountDownLatch.await(1 minute) here instead? that way not too many logs will be printed and also it wouldn't wait any more than necessary ?,"CompletableFuture.runAsync() uses the common pool which isn't the best option for a potentially long blocking call like Producer.flush(). Even if we provide our own thread pool to runAsync(), the CompletableFuture we'll get won't give us a way to interrupt a Producer.flush() call that exceeds the allowed timeout, which is necessary to free up the thread-pool thread in question. This is because calling cancel(true) on a CompletableFuture returned by runAsync() only causes a cancellation exception to be propagated without interrupting the blocked thread pool. I'm afraid our only option here seems to be using an ExecutorService directly java // It's okay to use a single thread executor since flush() is synchronized ExecutorService executor = Executors.newSingleThreadExecutor(); Future<?> future = executor.submit(() -> super.flush()); try { // Block until timeout elapses future.get(_flushTimeout, TimeUnit.MILLISECONDS); } catch (TimeoutException e) { ... // Interrupt the Producer.flush() call to free up the blocked thread future.cancel(true); ... }",Exception can be included as a separate parameter.,Superfluous check I think-it has been a long time since Executors were reused.,Can this be overloaded to avoid the casts?,m,can just do if (StringUtils.isBlank(id)) { return; } to reduce nesting level,"trace seems too low, how often will this happen?",Why do we need that change here and not for aligned barriers?,Marking this as a high-priority functional correctness issue.
"public Metadata(Map<String, String[]> metadata) { md = metadata; }",I would check for null and make a copy of the map,"suggestion ""\narmed="" + m_armed;","more of a personal taste question, but why don't you like Guava MoreObjects ?","I don't see why you introduced mutability here? Local variables would have worked just as well. If you really want that, please at least make the setters package-private.",use Long.valueOf() instead of new Long() - always for performance reasons,if these Boolean methods can never be null why not have the return type be boolean instead of Boolean ?,I suggest to check defaults != this before setting.,Please Specify the type properly here like Iterator<StorageLocation>.,return quickFilters,null?,Should these throw UnsupportedExceptions?
"private void evaluateXPath() { Document document = getWebSourceCode().getDocument(expression.contains("":"")); try { NodeList nodes = (NodeList) getXPathExpressionForDocument(document).evaluate(document, XPathConstants.NODESET); for (int i = 0; i < nodes.getLength(); i++) { int lineNumber = getWebSourceCode().getLineForNode(nodes.item(i)); createViolation(lineNumber); } } catch (XPathExpressionException exceptionNodeSet) { try { Boolean result = (Boolean) getXPathExpressionForDocument(document).evaluate(document, XPathConstants.BOOLEAN); if (result) { createViolation(0); } } catch (XPathExpressionException exceptionBoolean) { throw new IllegalStateException(String.format(""Can't evaluate expression \""%s\"""", expression), exceptionBoolean); } } }",![CRITICAL](<LINK_1> Either log or rethrow this exception. [![rule](<LINK_2>](<LINK_0>,"Checking for failure here leads to a non-id qualifier being used with a compound id being a parse error. Could we follow the other parse* functions and let it fail later, as a semantic error? If for some reason we want to use compound ids with other qualifiers, it would be easier.",2048 looks like a magic number,"Strange to use an XMIException here, which would imply something is corrupted at the XMI level, which is not the case. Especially since there is a AirdResourceVersionMismatchException defined in the same patch which implements Resource.Diagnostic.","Are you tracking all files in the IDE ? If yes this could flood the log file a little bit depending on your sharing setup, e.g you do a partial sharing with only a few files.",Style-nit: Unnecessary blank line.,Is that a software issue? Then better do WARN and include the exception as a last param.,Please rename to edgeId.,can't we set these values in the constructor?,"Shouldn't the description be a bit more specific, e.g. which alias matched, and the stage finished at the end of the process?",rename 'resource'
"protected PageableResult doGetAll(RequestContext context) throws ResponseException { return new AlreadyPaged<AutoGenerationOption>(Context.getService(IdentifierSourceService.class).getAutoGenerationOption(3), context); }",What does the 3 parameter mean?,Can be inlined in the assertThat statement below.,This should be stored in a field.,"Hint: FeedbackUtil.java contains numerous convenience functions for visiting specific external pages, e.g. the FAQ page, the privacy policy, etc. We can simply add another function there that goes to this page.","emmmm i dont feel this replacement is necessary...and it might change what the code intends to do, as put will replace the value corresponding to the question even if the question is already associated with a value, but putIfAbsent only associate question with the new ArrayList<>() if the question is not associated to anything.",We dont need size variable here.,"After taking a second look, i think we do not need this call at all. All those check of ensure that a service is not started before schedule, etc, belong to the service layer API. Your role is to simply call Context.getSchedulerService().scheduleTask(task) and that is all.","Why should format(RevisionResource) return a ChangeInfo and not (at the very least) a RevisionInfo? Though ideally it would return a Map<String, ActionInfo>","I guess getOncoTree() returns List<OncoTreeNode> and we must return ArrayList<OncoTreeNode> ? Still, we don't really need to create a named variable here .. we could do: return new ArrayList<OncoTreeNode>(super.query ....","We talked about setting a chunk size. Shall we make it 1000 and set it in JobOptions? I'm not very happy about that location but other things like includeSrc, compressGenotypes, etc, are placed there too.",I'd increment a counter and assert its 1.
"protected BinaryLogicalFilterPredicate(FilterPredicate left, FilterPredicate right) { Preconditions.checkNotNull(left, ""left""); Preconditions.checkNotNull(right, ""right""); this.left = left; this.right = right; String name = getClass().getSimpleName().toLowerCase(); this.toString = name + ""("" + left + "", "" + right + "")""; }","same here:  this.left = checkNotNull(left, ""left"");","Again, getMessage() should be replaced with a more informative error",so this will produce invalid output. if we have highest ID 0 then we will return 0 as first valid id. this should be an Optional<Long> and the return look like:  return highest.isPresent() ? highest.get() + 1 : 0;  also we might have a test for this method to be sure we don't break it in the future,For test stability we maintain the previous quiet period of 0. But live behavior will change.,"File(planStorePath, queryId + "".plan"")",Catching the exception hides network- and classpath/structural problems and returns null to the caller.,"Do we still need the token length here? It seems that the TokenProvider retrieves it from the config itself, doesn't it?","configuration should be injected, not read from system properties in the constructor.",url should be checked for null.,"It it better to throw unchecked exception than simply print error because if error occurs then variable 'm' will be null and NullPointerException will be thrown later (line 16). try { m = MessageDigest.getInstance(""MD5""); } catch (NoSuchAlgorithmException e) { e.printStackTrace(); //use logger instead throw new RuntimeException(""No Such Algorithm: MD5""); }","yeah, this is definitely a bad idea, since exclude may be equal to, say, ""hey"" and the entire code will crash. Let's find a way to use Xembly"
"public boolean setAlwaysOnVpnPackage(int userId, String packageName, boolean lockdown) { enforceConnectivityInternalPermission(); enforceCrossUserPermission(userId); if (LockdownVpnTracker.isEnabled()) { return false; } synchronized (mVpns) { Vpn vpn = mVpns.get(userId); if (vpn == null) { Slog.w(TAG, ""User "" + userId + "" has no Vpn configuration""); return false; } if (!vpn.setAlwaysOnPackage(packageName, lockdown)) { return false; } if (!startAlwaysOnVpn(userId)) { vpn.setAlwaysOnPackage(null, false); return false; } } return true; }","Shouldn't this be inside the synchronized{} block ? Also, can't this be simplified to if (!mLockdownEnabled) ?","BTW: if ""getEntity()"" either returns the result or throws a WebApplicationException exception with ""NOT_FOUND"" status, the code can be simplified to always ""return true"" at the end and no need in ""unregisteredDisk"" local variable at all.",Minor: you can extract this null check and the in-memory format/eviction policy check into a static method and invoke it from here and other implementations of ForcedEviction,I think we need to maintain the backwards compatibility for the old skewl setSpeed . our new proper method is setVelocity which takes a double that specifies the angular velocity of the servo that we will try to achieve.,is it possible that getDruidNode() or getHostAndPortToUse() are null?,We should process data from this report before validating again.,Prefer ActionParameters.getRequiredParamLong(PARAM_ID) instead. If the id is not a long we don't want to fail with ActionDeniedException but with a ActionParamsExcepton instead.,This could throw a NPE if options has timeseries but not metadata under it.,Fully-qualified class name not needed.,"trace seems too low, how often will this happen?",why not boolean? (lowercase?)
"private FilterExpression parseQualifierContent(QualifierType type) { if (type == QualifierType.SORT) { return parseSortKeys(); } else if (isCompoundId(type, lookAhead())) { return parseCompoundId(); } else if (isRangeOperatorToken(lookAhead())) { return parseRangeOperator(type, lookAhead()); } else if (isDateToken(lookAhead())) { return parseDateOrDateRange(type); } else if (isNumberToken(lookAhead())) { return parseNumberOrNumberRange(type); } else if (isQuotedContentToken(lookAhead())) { Token quotedContent = consume(); return parseQuotedContent(type, quotedContent); } else if (isKeywordToken(lookAhead())) { return new Qualifier(type, consume().getValue()); } else { throw new ParseException(String.format(""Invalid content for qualifier %s: %s"", type, lookAhead())); } }","Checking for failure here leads to a non-id qualifier being used with a compound id being a parse error. Could we follow the other parse* functions and let it fail later, as a semantic error? If for some reason we want to use compound ids with other qualifiers, it would be easier.",Please rename to edgeId.,Put this snippet of getting alterationNames into a function. Since the same code is used in printEvidences(),"Strange to use an XMIException here, which would imply something is corrupted at the XMI level, which is not the case. Especially since there is a AirdResourceVersionMismatchException defined in the same patch which implements Resource.Diagnostic.",Style-nit: Unnecessary blank line.,suggestion if (filter.getRelationshipDirection() == Direction.INCOMING) {,you should use res.isWorseThan(Result.SUCCESS) instead. <LINK_0>,"- This should be done in the previous if statement (after tech checks), to not return earlier (Windows test could still be done). Also, worth extracting a method to reduce code duplication (boolean isEvidencePresent(Pattern)?). - Since the result is not required the StringBuilder can be null.",iirc the source is added later in the controller and not part of the request.,Do you think it's worthwhile to check !targetAccountName.isEmpty() as well? Same for container's check.,_== true_ part is not needed as booleanForKeyWithDefault already returns a boolean ;)
protected Optional<DominantHandProperty> getForEntity(Entity entity) { if(!(entity instanceof EntityPlayer)) return Optional.empty(); EnumHandSide hand = ((EntityPlayer) entity).getPrimaryHand(); HandType type = (HandType) (Object) hand; return Optional.of(new DominantHandProperty(type)); },"if (, and if statements require braces.",Making *really* sure it's null? ;),For test stability we maintain the previous quiet period of 0. But live behavior will change.,"Why should format(RevisionResource) return a ChangeInfo and not (at the very least) a RevisionInfo? Though ideally it would return a Map<String, ActionInfo>",Is there a need to read the prop file for every request?,"I guess getOncoTree() returns List<OncoTreeNode> and we must return ArrayList<OncoTreeNode> ? Still, we don't really need to create a named variable here .. we could do: return new ArrayList<OncoTreeNode>(super.query ....",Catching the exception hides network- and classpath/structural problems and returns null to the caller.,"This too, possibly",Small detail: missing this.. See the line you replaced for ex.,do not throw RuntimeException,This code to get the feature is used here and in the remove method. I'd suggest to create a new BackendClusterFeatureHelper class and put this code there. Then you can call it from these methos. Look at BackendDataCenterHelper for example.
"private boolean isUnregisteredDisk() { DiskImage unregisteredDisk; storagePoolId = BackendDataCenterHelper.lookupByStorageDomainId(this, storageDomainId); try { GetUnregisteredDiskQueryParameters getDiskParams = new GetUnregisteredDiskQueryParameters(guid, storageDomainId, storagePoolId); unregisteredDisk = getEntity(DiskImage.class, QueryType.GetUnregisteredDisk, getDiskParams, guid.toString()); } catch (WebApplicationException e) { if (e.getResponse().getStatus() == Response.Status.NOT_FOUND.getStatusCode()) { return false; } throw e; } return unregisteredDisk != null; }","BTW: if ""getEntity()"" either returns the result or throws a WebApplicationException exception with ""NOT_FOUND"" status, the code can be simplified to always ""return true"" at the end and no need in ""unregisteredDisk"" local variable at all.","File(planStorePath, queryId + "".plan"")",Is this test really testing much? It doesn't assert that the result is not a failure: !(result instanceof Failed) for instance.,This could throw a NPE if options has timeseries but not metadata under it.,is it possible that getDruidNode() or getHostAndPortToUse() are null?,Prefer ActionParameters.getRequiredParamLong(PARAM_ID) instead. If the id is not a long we don't want to fail with ActionDeniedException but with a ActionParamsExcepton instead.,instead you could use the try-with-resource paradigm,brackets don't match coding style,"I believe it would be easier to do check !ifPresent and skip rest, instead of creating that first lambda. if you like 2 lambdas approach instead of one if and one lambda, then fine, but extract method to contain second lambda, because lambda in lambda ... that's like watching Inception again, and nobody should be forced to watch that...",Is error the right log level here? Seems like warn or even info would be more appropriate.,Fully-qualified class name not needed.
public long getFileSize(String ext) { Long size = sizeMap.get(ext); return (size == null) ? 0 : size.longValue(); },No parens on condition.,if these Boolean methods can never be null why not have the return type be boolean instead of Boolean ?,null?,"more of a personal taste question, but why don't you like Guava MoreObjects ?",@doom369 just wondering if we should call encodeToString  directly. WDYT ?,"Can't really understand what's going on here. We multiply by 1,000,000 a millisecond unit and add it as a nanosecond? (it would _probably_ make sense if we divided instead of multiply, but then why not just do now.plus(resyncPeriodInMillis, ChronoUnit.MILLIS))",I still think you should throw an exception if name is null,you could just do setConfirmWindow(null); like above method,Please Specify the type properly here like Iterator<StorageLocation>.,"Or even better, this.mName = Objects.requireNonNull(name);. To be check everywhere else.","suggestion ""\narmed="" + m_armed;"
public boolean tryAdvance(Consumer<? super BytesHandle> action) { try { FormatEntry nextEntry = getNextEntry(); if (nextEntry == null) { return false; } BytesHandle nextBytesHandle = readEntry(nextEntry); action.accept(nextBytesHandle); splitter.count++; } catch (IOException e) { e.printStackTrace(); } return true; },"The IDEs tend to generate boilerplate code that suppresses exceptions. Unless we know it is safe to suppress an exception, the best practice is to throw the exception. In this case, if we encounter an IOException, something must be wrong with the zipfile. Where the exception is a checked exception (like IOException) that's not allowed by the signature (as with the tryAdvance() method), we can rethrow it with something like throw new RuntimeException(""Could not read ZipEntry"", e); To be clear, the same issue affects the other tryAdvance() method.",For test stability we maintain the previous quiet period of 0. But live behavior will change.,"File(planStorePath, queryId + "".plan"")",putIfAbsent semantics is better,Catching the exception hides network- and classpath/structural problems and returns null to the caller.,return before instantiating the map?,Making *really* sure it's null? ;),"this used to bail after this call if it wasn't the root, does returning v. not returning from onCreate() in that case affect anything?",I am confused b/w the description and implementation of filter here.,nitpicking: would be nice to break from the loop here,do not throw RuntimeException
public static ViewGroup.OnHierarchyChangeListener tryGetOnHierarchyChangeListenerHack( ViewGroup viewGroup) { if (sOnHierarchyChangeListenerField == null) { return null; } try { return (ViewGroup.OnHierarchyChangeListener)sOnHierarchyChangeListenerField.get(viewGroup); } catch (IllegalAccessException e) { throw new RuntimeException(e); } },"This too, possibly",Lets re-throw this as a RuntimeException instead.,putIfAbsent semantics is better,For test stability we maintain the previous quiet period of 0. But live behavior will change.,Making *really* sure it's null? ;),"After taking a second look, i think we do not need this call at all. All those check of ensure that a service is not started before schedule, etc, belong to the service layer API. Your role is to simply call Context.getSchedulerService().scheduleTask(task) and that is all.",Maybe change this to assertThat(downloader).isInstanceOf(OkHttpDownloader.class) ?,duplicate logic in getPrivateKeyAlias method().,nit: space,Let's avoid FQNs as much as we can.,we should stop the queueRequestSender ?
