code,review,top_1,top_2,top_3,top_4,top_5,top_6,top_7,top_8,top_9,top_10
"public int getLength() { Widget widget = getWidget(); int childCount = 0; if (widget instanceof Composite) { childCount = ((Composite) widget).getChildren().length; if (widget instanceof CTabFolder) { for (CTabItem tabItem : ((CTabFolder) widget).getItems()) { if (tabItem.isDisposed()) { System.err.println(""CTabItem was disposed""); break; } else { childCount++; } } } } return childCount; }",The syserr should come out.,"@unyoungwax, oops missed this, but consider prefixing this boolean with <code>is...</code>","File(planStorePath, queryId + "".plan"")","You can use RAIS plane2 = plane here, e.g.:  import java.io.Closeable; class C implements Closeable { public void close() { System.out.println(""closed""); } } public class M { public static void main(String[] args) { C c = new C(); try (C c2 = c) { System.out.println(""done""); } } }","Yes had that on my to do list, but missed it.","BTW: if ""getEntity()"" either returns the result or throws a WebApplicationException exception with ""NOT_FOUND"" status, the code can be simplified to always ""return true"" at the end and no need in ""unregisteredDisk"" local variable at all.",I think we need to maintain the backwards compatibility for the old skewl setSpeed . our new proper method is setVelocity which takes a double that specifies the angular velocity of the servo that we will try to achieve.,This could throw a NPE if options has timeseries but not metadata under it.,There is a problem here :cry: :disappointed: We need to change the library since trackaliasUser uses TracksClient.NosaraUserType.WPCOM (wpcom:user_id) internally. We should add another trackaliasUser method that takes the userType parameter....,"Wouldn't a top-level if (stopRefresh) guard condition be better, instead of checking it within the loop?",you can just use a primitive long here
"static org.ovirt.engine.core.common.businessentities.VM setUpEntityExpectations( org.ovirt.engine.core.common.businessentities.VM entity, VmStatistics statistics, int index) { expect(entity.getId()).andReturn(GUIDS[index]).anyTimes(); expect(entity.getvds_group_id()).andReturn(GUIDS[2]).anyTimes(); expect(entity.getvm_name()).andReturn(NAMES[index]).anyTimes(); expect(entity.getvm_description()).andReturn(DESCRIPTIONS[index]).anyTimes(); expect(entity.getnum_of_cpus()).andReturn(8).anyTimes(); expect(entity.getnum_of_sockets()).andReturn(2).anyTimes(); expect(entity.getusage_mem_percent()).andReturn(Integer.valueOf(20)).anyTimes(); expect(entity.getdisplay_type()).andReturn(DisplayType.vnc).anyTimes(); expect(entity.getdisplay_secure_port()).andReturn(5900).anyTimes(); expect(entity.getnum_of_monitors()).andReturn(2).anyTimes(); expect(entity.getvm_type()).andReturn(VmType.Server).anyTimes(); expect(entity.getrun_on_vds_name()).andReturn(NAMES[NAMES.length - 1]).anyTimes(); Map<String, DiskImage> diskImageMap = new HashMap<String, DiskImage>(); diskImageMap.put(""1"", new DiskImage()); expect(entity.getDiskMap()).andReturn(diskImageMap).anyTimes(); VmStatic vmStatic = new VmStatic(); vmStatic.setId(GUIDS[index]); vmStatic.setvm_name(NAMES[index]); expect(entity.getStaticData()).andReturn(vmStatic).anyTimes(); setUpStatisticalEntityExpectations(entity, statistics); return entity; }","this expectations relevant for your use-case only, no need for all tests to see them, please move them to your method which will extend expectations for setUpEntityExpectations()",Do a null check instead of catching the NPE. Can a try with resources be used?,Change doesn't belong to this PR,The exception name is not clear,"Are these checks really necessary ? Its possible that this condition is false, at the time of the check, but becomes true immediately after the evaluation.","Would be good to have constants for the builder types, right now they are hard-coded strings like ""DB"", ""Task"". WDYT?","Strange to use an XMIException here, which would imply something is corrupted at the XMI level, which is not the case. Especially since there is a AirdResourceVersionMismatchException defined in the same patch which implements Resource.Diagnostic.",EnumMachineAlpha.STEAM_OVEN.getState()?,debug logging should not change the applicationflow. getAttributesOrThrow would. getAttributesOrDefault is better I think,"verifyExceptionMatch() blocks on future.get(), so isDone() will always be true when you're here, no? Also, if the callback was received, then we should ensure that future.get() returns immediately as well, so shouldn't it be a timed get within verifyExceptionMatch()?","Does it matter that ""firstName"" and ""lastName"" are still the keys here? Probably should be full and friendly anyway?"
"public List<String> getDirectory() throws OwException { List<String> directory = new ArrayList<String>(); OwserverPacket requestPacket = new OwserverPacket(OwserverMessageType.DIR, ""/""); write(requestPacket); OwserverPacket returnPacket = null; do { try { returnPacket = read(false); } catch (OwException e) { logger.info(""getDirectory may have returned incomplete result: {}"", e.getMessage()); closeOnError(); return directory; } if (returnPacket.hasPayload()) { directory.add(returnPacket.getPayloadString()); } } while ((returnPacket.isPingPacket() || returnPacket.hasPayload())); if (!returnPacket.hasControlFlag(OwserverControlFlag.PERSISTENCE)) { logger.trace(""closing connection because persistence was denied""); close(); } connectionErrorCounter = 0; return directory; }",Is that a software issue? Then better do WARN and include the exception as a last param.,Style-nit: Unnecessary blank line.,All the above tests are already covered by the BaseComputeServiceLiveTest. You should subclass that one and try to make all tests pass without overriding its methods (as that is our compute service implementation contract). Take the [DigitalOcean](<LINK_0> one as an example.,"find a better way, this is super dodgy","Maybe I'm being daft, but where are the CDA message being added?","please fix typo listner, should be listener ?","It'd be helpful to remind what's going on here, especially mentioning that _In case when a worker's local state is behind the globally synchronized state, this implies the worker is added by EM. If so, the worker is replied to continue until it reaches the global state_.",Superfluous check I think-it has been a long time since Executors were reused.,Minor: you can extract this null check and the in-memory format/eviction policy check into a static method and invoke it from here and other implementations of ForcedEviction,rename 'resource',Non-modify entries should be added back onto newEntries.
"public void start() throws Exception { synchronized (lock) { if (childrenCache != null) { return; } childrenCache = cacheFactory.make(curatorFramework, config.getContainerPath()); } ContainerCacheListener containerCacheListener = new ContainerCacheListener(); childrenCache.getListenable().addListener(containerCacheListener); try { childrenCache.start(PathChildrenCache.StartMode.POST_INITIALIZED_EVENT); } catch (Exception e) { synchronized (lock) { try { stop(); } catch (IOException e1) { log.error(e1, ""Exception when stopping InventoryManager that couldn't start.""); } } throw e; } while (!containerCacheListener.doneInitializing) { Thread.sleep(2000); log.info(""Waiting for PathChildrenCache to be completely loaded.""); } }",can we use a CountDownLatch.await(1 minute) here instead? that way not too many logs will be printed and also it wouldn't wait any more than necessary ?,Superfluous check I think-it has been a long time since Executors were reused.,is it possible that getDruidNode() or getHostAndPortToUse() are null?,Style-nit: Unnecessary blank line.,"CompletableFuture.runAsync() uses the common pool which isn't the best option for a potentially long blocking call like Producer.flush(). Even if we provide our own thread pool to runAsync(), the CompletableFuture we'll get won't give us a way to interrupt a Producer.flush() call that exceeds the allowed timeout, which is necessary to free up the thread-pool thread in question. This is because calling cancel(true) on a CompletableFuture returned by runAsync() only causes a cancellation exception to be propagated without interrupting the blocked thread pool. I'm afraid our only option here seems to be using an ExecutorService directly java // It's okay to use a single thread executor since flush() is synchronized ExecutorService executor = Executors.newSingleThreadExecutor(); Future<?> future = executor.submit(() -> super.flush()); try { // Block until timeout elapses future.get(_flushTimeout, TimeUnit.MILLISECONDS); } catch (TimeoutException e) { ... // Interrupt the Producer.flush() call to free up the blocked thread future.cancel(true); ... }",Exception can be included as a separate parameter.,2048 looks like a magic number,Marking this as a high-priority functional correctness issue.,calling stop multiple times should return true thought,Can this be overloaded to avoid the casts?,"trace seems too low, how often will this happen?"
"public void testDoubletonFlatbush() { List<Rectangle> items = new ArrayList<>(); Rectangle rect0 = new Rectangle(1, 1, 1, 1); items.add(rect0); Rectangle rect1 = new Rectangle(-1, -2, -1, -1); items.add(rect1); items.sort(RECTANGLE_COMPARATOR); Flatbush<Rectangle> rtree = new Flatbush<>(items.toArray(new Rectangle[] {})); List<Rectangle> allResults = findIntersections(rtree, EVERYTHING); allResults.sort(RECTANGLE_COMPARATOR); assertEquals(allResults, items); Rectangle hit0 = new Rectangle(1, 1, 2, 2); assertEquals(findIntersections(rtree, hit0), ImmutableList.of(rect0)); Rectangle hit1 = new Rectangle(-2, -2, -1, -2); assertEquals(findIntersections(rtree, hit1), ImmutableList.of(rect1)); Rectangle totalMiss = new Rectangle(10, 10, 12, 12); assertEquals(findIntersections(rtree, totalMiss), ImmutableList.of()); Rectangle marginalMiss = new Rectangle(0, 0, 0, 0); assertEquals(findIntersections(rtree, marginalMiss), ImmutableList.of()); }","use ImmutableList.of() and assertEqualsNoOrder  Rectangle rect0 = new Rectangle(1, 1, 1, 1); Rectangle rect1 = new Rectangle(-1, -2, -1, -1); List<Rectangle> items = ImmutableList.of(rect0, rect1); Flatbush<Rectangle> rtree = new Flatbush<>(items.toArray(new Rectangle[] {})); List<Rectangle> allResults = findIntersections(rtree, EVERYTHING); assertEqualsNoOrder(allResults.toArray(), items.toArray());  ditto testTwoLevelFlatbush","we don't use braces around single line blocks, many more occurrences in this patch",These ^ could be final.,This test needs a verification.,Please rename to edgeId.,EnumMachineAlpha.STEAM_OVEN.getState()?,Should this be in an entitlement?,We need to check to check what happens with no value and some value snaks.,Do you think it's worthwhile to check !targetAccountName.isEmpty() as well? Same for container's check.,"I think you should be able to use Tasks.forResult(new FakeAuthResult(mockFirebaseUser)) instead of a mock object without consequence here, it should be more readable.",This leaves ActivityLauncher.newGalleryPost() unused - I think we should probably clean that up too.
public void onDeniedPendingLockNotification() { synchronized (ZKDistributedNonblockingLock.this) { _isLocked = false; _isPreempted = true; _isPending = false; ZKDistributedNonblockingLock.this.notify(); } },Looks like a lock can only be in one state at a time. I suggest merging these 2 booleans into an enum for the cleanness of the code and the logic.,Why not inline this variable?,"emmmm i dont feel this replacement is necessary...and it might change what the code intends to do, as put will replace the value corresponding to the question even if the question is already associated with a value, but putIfAbsent only associate question with the new ArrayList<>() if the question is not associated to anything.",It doesn;t look like the membership of these connections have been changed yet.. Should removeTelephonyConnection be called for all of the connections first?,isn't finishing tied to joinPagesNotNeeded not being empty? Maybe just get rid of it and then then becomes return joinPagesNotNeeded.orElse(NOT_BLOCKED),"fyi, you can use @Factory method to replace the actually tested instance (its methods have to be annotated with @Test ofc)",Showing size here would help users to understand what's wrong since it's likely users don't know an actual number of tasks with step.,"Colon after ""used""",My guess is that ResponseUrlDataCleanupJob.class should be used here in stead of ResponseDataCleanupJob.class?,putIfAbsent semantics is better,"configuration should be injected, not read from system properties in the constructor."
"public void generateExperimentalCoordinates(Vector2d firstBondVector) throws CDKException { IMolecule original = molecule; IMolecule shallowCopy = molecule.getBuilder().newInstance(IMolecule.class,molecule); for (IAtom curAtom : shallowCopy.atoms()) { if (curAtom.getSymbol().equals(""H"")) { int bondsFromCurAtom=0; for (IBond bond : shallowCopy.bonds()) if(bond.contains (curAtom)) ++bondsFromCurAtom; if (bondsFromCurAtom < 2) { shallowCopy.removeAtomAndConnectedElectronContainers(curAtom); curAtom.setPoint2d(null); } } } molecule = shallowCopy; generateCoordinates(firstBondVector); double bondLength = GeometryTools.getBondLengthAverage(molecule); HydrogenPlacer hPlacer = new HydrogenPlacer(); molecule = original; hPlacer.placeHydrogens2D(molecule, bondLength); }",IAtomContainer.getConnectedBondsCount()? or IAtomContainer.getConnectedAtomsCount()? <LINK_0>,EnumMachineAlpha.STEAM_OVEN.getState()?,All the above tests are already covered by the BaseComputeServiceLiveTest. You should subclass that one and try to make all tests pass without overriding its methods (as that is our compute service implementation contract). Take the [DigitalOcean](<LINK_0> one as an example.,"we don't use braces around single line blocks, many more occurrences in this patch",Non-modify entries should be added back onto newEntries.,m,"Maybe I'm being daft, but where are the CDA message being added?",Please rename to edgeId.,Why is isEmpty() treated special here? Why is it possible for the hash to be empty?,rename 'resource',_== true_ part is not needed as booleanForKeyWithDefault already returns a boolean ;)
"private String createBuildsStats(MemoryImprint memoryImprint, TaskListener listener, Map<String, String> parameters) { StringBuilder str = new StringBuilder(""""); final String rootUrl = hudson.getRootUrl(); String unsuccessfulMessage = null; Entry[] entries = memoryImprint.getEntries(); if (entries.length > 0) { str.append(""\n""); for (Entry entry : entries) { AbstractBuild build = entry.getBuild(); if (build != null) { GerritTrigger trigger = GerritTrigger.getTrigger(build.getProject()); Result res = build.getResult(); String customMessage = null; str.append(""\n\n""); if (trigger.getCustomUrl() == null || trigger.getCustomUrl().isEmpty()) { str.append(rootUrl).append(entry.getBuild().getUrl()); } else { str.append(expandParameters(trigger.getCustomUrl(), build, listener, parameters)); } str.append(MESSAGE_DELIMITER); if (res == Result.SUCCESS) { customMessage = trigger.getBuildSuccessfulMessage(); } else if (res == Result.FAILURE || res == Result.ABORTED) { customMessage = trigger.getBuildFailureMessage(); } else if (res == Result.UNSTABLE) { customMessage = trigger.getBuildUnstableMessage(); } else { customMessage = trigger.getBuildFailureMessage(); } if (customMessage == null || customMessage.equals("""")) { str.append(res.toString()); } else { str.append(customMessage); } if (res != Result.SUCCESS) { unsuccessfulMessage = entry.getUnsuccessfulMessage(); if (null != unsuccessfulMessage && !unsuccessfulMessage.isEmpty()) { logger.trace(""Using unsuccessful message from file.""); str.append("" <<<\n""); str.append(unsuccessfulMessage.trim()); str.append(""\n>>> ""); } } } } } else { logger.error(""I got a request to create build statistics, but no entries where found!""); } return str.toString(); }",you should use res.isWorseThan(Result.SUCCESS) instead. <LINK_0>,"Strange to use an XMIException here, which would imply something is corrupted at the XMI level, which is not the case. Especially since there is a AirdResourceVersionMismatchException defined in the same patch which implements Resource.Diagnostic.",We need to check to check what happens with no value and some value snaks.,"Would be good to have constants for the builder types, right now they are hard-coded strings like ""DB"", ""Task"". WDYT?",Needs quotes around the msbuild command,"verifyExceptionMatch() blocks on future.get(), so isDone() will always be true when you're here, no? Also, if the callback was received, then we should ensure that future.get() returns immediately as well, so shouldn't it be a timed get within verifyExceptionMatch()?",one more progress monitor change,Do you think it's worthwhile to check !targetAccountName.isEmpty() as well? Same for container's check.,EnumMachineAlpha.STEAM_OVEN.getState()?,"Maybe having such method would be nicer: buildUser(T params, String authzName) { boolean externalSsoEnabled = EngineLocalConfig.getInstance().getBoolean(""ENGINE_SSO_ENABLE_EXTERNAL_SSO""); buildUser(externalSsoEnabled , params, authzName) { }",Please rename to edgeId.
public void visitNode(Tree tree) { if (tree.is(Kind.METHOD) && isServletInit((MethodTree) tree)) { tree.accept(new AssignmentVisitor()); } else if (tree.is(Kind.VARIABLE)) { VariableTree variable = (VariableTree) tree; if (hasSemantic() && isOwnedByAServlet(variable) && !isStaticOrFinal(variable)) { issuableVariables.add(variable); } } },"checking for the semantic should be done before checking the type of the tree, as semantic is used to get the parameter type of the method.",can just do if (StringUtils.isBlank(id)) { return; } to reduce nesting level,Is this test really testing much? It doesn't assert that the result is not a failure: !(result instanceof Failed) for instance.,"@unyoungwax, oops missed this, but consider prefixing this boolean with <code>is...</code>",Put this snippet of getting alterationNames into a function. Since the same code is used in printEvidences(),"Wouldn't a top-level if (stopRefresh) guard condition be better, instead of checking it within the loop?",Can we combine this case with the one above? if (selectionSet instanceof String || selectionSet instanceOf Number),return false ?,Please check [our guidelines](<LINK_0> on source code style.,Can we add an actual exception message if we ever run into this issue in production.,"Checking for failure here leads to a non-id qualifier being used with a compound id being a parse error. Could we follow the other parse* functions and let it fail later, as a semantic error? If for some reason we want to use compound ids with other qualifiers, it would be easier."
"public void shouldNotExpireChargesWhenAwaitingCaptureDelayIsLessThan48Hours() { String extChargeId1 = addCharge(CREATED, ""ref"", ZonedDateTime.now().minusMinutes(90), RandomIdGenerator.newId()); String extChargeId2 = addCharge(AWAITING_CAPTURE_REQUEST, ""ref"", ZonedDateTime.now().minusHours(48L).plusMinutes(1L), RandomIdGenerator.newId()); worldpayMockClient.mockCancelSuccess(); connectorRestApiClient .postChargeExpiryTask() .statusCode(OK.getStatusCode()) .contentType(JSON) .body(""expiry-success"", is(1)) .body(""expiry-failed"", is(0)); connectorRestApiClient .withAccountId(accountId) .withChargeId(extChargeId1) .getCharge() .statusCode(OK.getStatusCode()) .contentType(JSON) .body(JSON_CHARGE_KEY, is(extChargeId1)) .body(JSON_STATE_KEY, is(EXPIRED.toExternal().getStatus())); connectorRestApiClient .withAccountId(accountId) .withChargeId(extChargeId2) .getCharge() .statusCode(OK.getStatusCode()) .contentType(JSON) .body(JSON_CHARGE_KEY, is(extChargeId2)) .body(JSON_STATE_KEY, is(AWAITING_CAPTURE_REQUEST.toExternal().getStatus())); List<String> events1 = databaseTestHelper.getInternalEvents(extChargeId1); List<String> events2 = databaseTestHelper.getInternalEvents(extChargeId2); assertTrue(isEqualCollection(events1, asList(CREATED.getValue(), EXPIRED.getValue()))); assertTrue(isEqualCollection(events2, asList(AWAITING_CAPTURE_REQUEST.getValue()))); }",not sure what role this charge is playing in the test,not sure how often this can be logged so maybe change the level to debug and also log the event that is being ignored?,The variables eperson and ePerson are confusing in the same block. Could more specific names be used?,"Would be nice for the test to pass without modifications, to show backwards compatibility.",@pecko let's also assert it does not contain the other string.,"Maybe having such method would be nicer: buildUser(T params, String authzName) { boolean externalSsoEnabled = EngineLocalConfig.getInstance().getBoolean(""ENGINE_SSO_ENABLE_EXTERNAL_SSO""); buildUser(externalSsoEnabled , params, authzName) { }","you've change order of expected and actual (error string will be wrong in case of fail) to not repeat this mistake simply use assertThat(actual, matcherForIt()) - thats more friendly to any reviewer or maintaineer","nit: The metric is millis, not seconds",Not related to gender type,"This will prevent changing to null, which should be allowed",Do we have to use the configurator for fetching 'MaxVmsInPool' value? A lot of configuration values are fetched in 'VmModelBehaviorBase' (e.g. GetMaxNumOfVmSockets) - try to retrieve it once 'PoolModelBehaviorBase' if it's not too cumbersome.
"public void updateSource(TaskSource sourceUpdate) { checkLockNotHeld(""Can not update sources while holding the driver lock""); checkArgument(sourceOperator.isPresent() && sourceOperator.get().getSourceId().equals(sourceUpdate.getPlanNodeId())); pendingTaskSourceUpdates.updateAndGet(current -> current == null ? sourceUpdate : current.update(sourceUpdate)); tryWithLock(() -> TRUE); }",Add a message to the checkArgument call.,"prevShip.ini shouldn't be used here, now that you have the constant defined. In fact, I don't think the file should be passed to the save manager, as that's more of a save manager concern. I would consider moving all of this logic into the hasPrevShip function.",Reverse the operands to avoid negation maybe? Would look nicer.,wouldn't it be easier if you do this in the tank? also you can just return null here as nobody uses this as far as i know,This code to get the feature is used here and in the remove method. I'd suggest to create a new BackendClusterFeatureHelper class and put this code there. Then you can call it from these methos. Look at BackendDataCenterHelper for example.,putIfAbsent semantics is better,Is error the right log level here? Seems like warn or even info would be more appropriate.,"this used to bail after this call if it wasn't the root, does returning v. not returning from onCreate() in that case affect anything?","configuration should be injected, not read from system properties in the constructor.","I believe it would be easier to do check !ifPresent and skip rest, instead of creating that first lambda. if you like 2 lambdas approach instead of one if and one lambda, then fine, but extract method to contain second lambda, because lambda in lambda ... that's like watching Inception again, and nobody should be forced to watch that...",the constructor already asserts that
"protected int persistHydrant( FireHydrant indexToPersist, DataSchema schema, Interval interval, Map<String, Object> metadataElems ) { synchronized (indexToPersist) { if (indexToPersist.hasSwapped()) { log.info( ""DataSource[%s], Interval[%s], Hydrant[%s] already swapped. Ignoring request to persist."", schema.getDataSource(), interval, indexToPersist ); return 0; } log.info( ""DataSource[%s], Interval[%s], Metadata [%s] persisting Hydrant[%s]"", schema.getDataSource(), interval, metadataElems, indexToPersist ); try { int numRows = indexToPersist.getIndex().size(); final IndexSpec indexSpec = config.getIndexSpec(); indexToPersist.getIndex().getMetadata().putAll(metadataElems); final File persistedFile = indexMerger.persist( indexToPersist.getIndex(), interval, new File(computePersistDir(schema, interval), String.valueOf(indexToPersist.getCount())), indexSpec, config.getSegmentWriteOutMediumFactory() ); indexToPersist.swapSegment( new QueryableIndexSegment(indexIO.loadIndex(persistedFile), indexToPersist.getSegmentId()) ); return numRows; } catch (IOException e) { log.makeAlert(""dataSource[%s] -- incremental persist failed"", schema.getDataSource()) .addData(""interval"", interval) .addData(""count"", indexToPersist.getCount()) .emit(); throw new RuntimeException(e); } } }",Change doesn't belong to this PR,The exception name is not clear,debug logging should not change the applicationflow. getAttributesOrThrow would. getAttributesOrDefault is better I think,m,"verifyExceptionMatch() blocks on future.get(), so isDone() will always be true when you're here, no? Also, if the callback was received, then we should ensure that future.get() returns immediately as well, so shouldn't it be a timed get within verifyExceptionMatch()?",Do a null check instead of catching the NPE. Can a try with resources be used?,"Strange to use an XMIException here, which would imply something is corrupted at the XMI level, which is not the case. Especially since there is a AirdResourceVersionMismatchException defined in the same patch which implements Resource.Diagnostic.",Can you create a constant for the -1? I'm not sure what that represents here.,Should this be in an entitlement?,"Rather than iterate over the whole model twice, just use the Resource interface to nagivate through child resources once.","Are these checks really necessary ? Its possible that this condition is false, at the time of the check, but becomes true immediately after the evaluation."
