code,review,top_1,top_2,top_3,top_4,top_5,top_6,top_7,top_8,top_9,top_10
"private String encrypt(String value) { try { return getStorageHelper().encrypt(mContext, value); } catch (GeneralSecurityException | IOException e) { Logger.e(TAG, ""Encryption failure"", """", ADALError.ENCRYPTION_FAILED, e); } return null; }",nit: space,Lets re-throw this as a RuntimeException instead.,For test stability we maintain the previous quiet period of 0. But live behavior will change.,"This too, possibly","Again, getMessage() should be replaced with a more informative error","After taking a second look, i think we do not need this call at all. All those check of ensure that a service is not started before schedule, etc, belong to the service layer API. Your role is to simply call Context.getSchedulerService().scheduleTask(task) and that is all.",Small detail: missing this.. See the line you replaced for ex.,Is there a need to read the prop file for every request?,"Why should format(RevisionResource) return a ChangeInfo and not (at the very least) a RevisionInfo? Though ideally it would return a Map<String, ActionInfo>",My guess is that ResponseUrlDataCleanupJob.class should be used here in stead of ResponseDataCleanupJob.class?,duplicate logic in getPrivateKeyAlias method().
public String getBackupIdentifier() { return Const.SystemParams.ACCOUNT_ATTRIBUTES_BACKUP_LOG_MSG + this.googleId; },"Beside AccountAttributes.java, there are more *Atrributes.java need to be changed.",Please Specify the type properly here like Iterator<StorageLocation>.,"more of a personal taste question, but why don't you like Guava MoreObjects ?","suggestion ""\narmed="" + m_armed;",if these Boolean methods can never be null why not have the return type be boolean instead of Boolean ?,This should be stored in a field.,No parens on condition.,null?,Please implement equals() method either. This will remove the potential problem when working with collections.,"Can't really understand what's going on here. We multiply by 1,000,000 a millisecond unit and add it as a nanosecond? (it would _probably_ make sense if we divided instead of multiply, but then why not just do now.plus(resyncPeriodInMillis, ChronoUnit.MILLIS))",I still think you should throw an exception if name is null
protected static WebDriver getCurrentBrowser() { return b.getCurrentWebDriver(); },"Are you sure that ""protected static"" is ok? To me it doesn't make sense as you can't override static methods.","just return """" instead of new String()",Please Specify the type properly here like Iterator<StorageLocation>.,use Long.valueOf() instead of new Long() - always for performance reasons,you could just do setConfirmWindow(null); like above method,"more of a personal taste question, but why don't you like Guava MoreObjects ?",This should be stored in a field.,The class passed on to the super constructor shouldn't be MbusChannelElementsDto. I think the cleanest would be to pass DecoupleMbusDto.class (and make DecoupleMbusDto implement ActionRequestDto).,Should this be using TmfCpuAspect?,"@orhan89 while you're add it, could you do a API version check and use isInteractive() if available?<LINK_0>",The create method call should be separate from the logger call.
"public void onlineUseCase() { Assume.assumeTrue(mCameraId != null); mCamera.open(); mCamera.addOnlineUseCase(Collections.<UseCase>singletonList(mFakeUseCase)); verify(mMockOnImageAvailableListener, never()).onImageAvailable(any(ImageReader.class)); mCamera.release(); }","Rather than put this in every test, you can just put it once in the setup() method.","CompletableFuture.runAsync() uses the common pool which isn't the best option for a potentially long blocking call like Producer.flush(). Even if we provide our own thread pool to runAsync(), the CompletableFuture we'll get won't give us a way to interrupt a Producer.flush() call that exceeds the allowed timeout, which is necessary to free up the thread-pool thread in question. This is because calling cancel(true) on a CompletableFuture returned by runAsync() only causes a cancellation exception to be propagated without interrupting the blocked thread pool. I'm afraid our only option here seems to be using an ExecutorService directly java // It's okay to use a single thread executor since flush() is synchronized ExecutorService executor = Executors.newSingleThreadExecutor(); Future<?> future = executor.submit(() -> super.flush()); try { // Block until timeout elapses future.get(_flushTimeout, TimeUnit.MILLISECONDS); } catch (TimeoutException e) { ... // Interrupt the Producer.flush() call to free up the blocked thread future.cancel(true); ... }",Is this test really testing much? It doesn't assert that the result is not a failure: !(result instanceof Failed) for instance.,Exception can be included as a separate parameter.,Add a message to the checkArgument call.,"Please use a better name (primaryKeys, primaryKeyColumns).",This code to get the feature is used here and in the remove method. I'd suggest to create a new BackendClusterFeatureHelper class and put this code there. Then you can call it from these methos. Look at BackendDataCenterHelper for example.,consider extracting to a method as this code is similar to BaseImagesCommand. have a nice day :),"BTW: if ""getEntity()"" either returns the result or throws a WebApplicationException exception with ""NOT_FOUND"" status, the code can be simplified to always ""return true"" at the end and no need in ""unregisteredDisk"" local variable at all.","just to be sure there is no index/dictionary involved: final ReferenceSequenceFile reference = new FastaSequenceFile(new File(TEST_DATA_DIR, ""nm_tag_validation.fa""), true); final SamReader samReader = SamReaderFactory. makeDefault(). validationStringency(ValidationStringency.SILENT). referenceSource(new ReferenceSource(reference)). ...",Costs 2.
"protected String buildPOFipsCountryCode(PaymentWorksVendor pmwVendor, Map<String, List<PaymentWorksIsoFipsCountryItem>> paymentWorksIsoToFipsCountryMap) { String fipsCountryCode = StringUtils.EMPTY; if (paymentWorksFormModeService.shouldUseLegacyFormProcessingMode()) { String paymentWorksVendorCountryCode = findPoCountryToUse(pmwVendor); fipsCountryCode = convertFipsPoCountryOptionToFipsCountryCode(paymentWorksVendorCountryCode); if (StringUtils.isBlank(fipsCountryCode)) { LOG.error(""buildPOFipsCountryCode, unable to find LEGACY FIPS country code for "" + paymentWorksVendorCountryCode); } } else if (paymentWorksFormModeService.shouldUseForeignFormProcessingMode()) { PaymentWorksPurchaseOrderCountryFipsOption option = PaymentWorksPurchaseOrderCountryFipsOption.findPaymentWorksPurchaseOrderCountryFipsOption(pmwVendor.getPoCountryUsCanadaAustraliaOther()); if (LOG.isDebugEnabled()) { LOG.debug(""buildPOFipsCountryCode, new foreign form FIPS country code option: "" + option.toString()); } if (StringUtils.isNotBlank(option.fipsCountryCode)) { fipsCountryCode = option.fipsCountryCode; } else { try { fipsCountryCode = convertIsoCountryCodeToFipsCountryCode(pmwVendor.getPoCountry(), paymentWorksIsoToFipsCountryMap); } catch (NullPointerException npe) { LOG.error(""buildPOFipsCountryCode, had and error converting '"" + pmwVendor.getPoCountry() + ""' to a FIPS code."", npe); fipsCountryCode = StringUtils.EMPTY; } } if (StringUtils.isBlank(fipsCountryCode)) { LOG.error(""buildPOFipsCountryCode, unable to find new foreign form FIPS country code for country code "" + pmwVendor.getPoCountry()); } } return fipsCountryCode; }","Minor typo in error message, should change from ""...had and error..."" to ""...had an error...""",Please leave msg.,Should this be in an entitlement?,"this code is very strange, can you explain to me because is necessary?",Why is isEmpty() treated special here? Why is it possible for the hash to be empty?,same here (!archSupportSnapshot) ? how about extract this check to separate method like 'isMemorySnapshotSupported' that checks the cluster compatibility version and the architecture (because I see that is appears multiple times here) ?,Needs quotes around the msbuild command,"Strange to use an XMIException here, which would imply something is corrupted at the XMI level, which is not the case. Especially since there is a AirdResourceVersionMismatchException defined in the same patch which implements Resource.Diagnostic.","Maybe having such method would be nicer: buildUser(T params, String authzName) { boolean externalSsoEnabled = EngineLocalConfig.getInstance().getBoolean(""ENGINE_SSO_ENABLE_EXTERNAL_SSO""); buildUser(externalSsoEnabled , params, authzName) { }",@tadamski If you cache this FilePermission in the containing FileSystemXAResourceRecoveryRegistry object you will save a per-transaction objection creation/gc.,"Are these checks really necessary ? Its possible that this condition is false, at the time of the check, but becomes true immediately after the evaluation."
public Boolean isWakeupEvent(ITmfEvent event) { String eventName = event.getName(); ITmfTrace trace = event.getTrace(); LttngEventLayout eventLayout = getProvider().getEventLayout(); String wakeupEventName = NonNullUtils.nullToEmptyString(fWakeupEventMap.get(trace)); if (wakeupEventName.equals(eventLayout.eventSchedProcessWaking()) && (eventName.equals(eventLayout.eventSchedProcessWaking()) || eventName.equals(eventLayout.eventSchedProcessWakeupNew()))) { return NonNullUtils.checkNotNull(Boolean.TRUE); } else if (wakeupEventName.equals(eventLayout.eventSchedProcessTTWU()) && eventName.equals(eventLayout.eventSchedProcessTTWU())) { return NonNullUtils.checkNotNull(Boolean.TRUE); } return NonNullUtils.checkNotNull(Boolean.FALSE); },why not boolean? (lowercase?),You could do this in the model itself because userGroup is already represented in model. getSlaveUserGroupName().setIsChangeable() can be used to make the ui-editor to enable or disable.,"Shouldn't this be inside the synchronized{} block ? Also, can't this be simplified to if (!mLockdownEnabled) ?","BTW: if ""getEntity()"" either returns the result or throws a WebApplicationException exception with ""NOT_FOUND"" status, the code can be simplified to always ""return true"" at the end and no need in ""unregisteredDisk"" local variable at all.","just to be sure there is no index/dictionary involved: final ReferenceSequenceFile reference = new FastaSequenceFile(new File(TEST_DATA_DIR, ""nm_tag_validation.fa""), true); final SamReader samReader = SamReaderFactory. makeDefault(). validationStringency(ValidationStringency.SILENT). referenceSource(new ReferenceSource(reference)). ...",You should test for both instructor and student?,This string should go into the messages.properties file.,suggestion if (filter.getRelationshipDirection() == Direction.INCOMING) {,Costs 2.,consider extracting to a method as this code is similar to BaseImagesCommand. have a nice day :),This could throw a NPE if options has timeseries but not metadata under it.
"private void triggerDeveloperBan(final CertifiedProductSearchDetails updatedListing) { Scheduler scheduler; try { scheduler = getScheduler(); TriggerKey triggerId = triggerKey(""triggerBanNow_"" + new Date().getTime(), ""triggerDeveloperBanTrigger""); JobKey jobId = jobKey(""Trigger Developer Ban Notification"", ""chplJobs""); Trigger qzTrigger = newTrigger() .withIdentity(triggerId) .startNow() .forJob(jobId) .usingJobData(""status"", updatedListing.getCurrentStatus().getStatus().getName()) .usingJobData(""dbId"", updatedListing.getId()) .usingJobData(""chplId"", updatedListing.getChplProductNumber()) .usingJobData(""developer"", updatedListing.getDeveloper().getName()) .usingJobData(""acb"", updatedListing.getCertifyingBody().get(""name"").toString()) .usingJobData(""changeDate"", new Date().getTime()) .usingJobData(""firstName"", Util.getCurrentUser().getFullName()) .usingJobData(""lastName"", Util.getCurrentUser().getFriendlyName()) .usingJobData(""effectiveDate"", updatedListing.getCurrentStatus().getEventDate()) .usingJobData(""openNcs"", updatedListing.getCountOpenNonconformities()) .usingJobData(""closedNcs"", updatedListing.getCountClosedNonconformities()) .build(); scheduler.scheduleJob(qzTrigger); } catch (SchedulerException e) { LOGGER.error(""Could not start Trigger Developer Ban"", e); } }","Does it matter that ""firstName"" and ""lastName"" are still the keys here? Probably should be full and friendly anyway?","There's a lot going on in this class, it creates subscriptions, spawns SelectiveSupervisorControllers, makes assertions. Maybe we could separate this work to different classes.","Would be good to have constants for the builder types, right now they are hard-coded strings like ""DB"", ""Task"". WDYT?","nit: The metric is millis, not seconds","this code is very strange, can you explain to me because is necessary?","I think you should be able to use Tasks.forResult(new FakeAuthResult(mockFirebaseUser)) instead of a mock object without consequence here, it should be more readable.",EnumMachineAlpha.STEAM_OVEN.getState()?,"you've change order of expected and actual (error string will be wrong in case of fail) to not repeat this mistake simply use assertThat(actual, matcherForIt()) - thats more friendly to any reviewer or maintaineer",This test needs a verification.,"Maybe having such method would be nicer: buildUser(T params, String authzName) { boolean externalSsoEnabled = EngineLocalConfig.getInstance().getBoolean(""ENGINE_SSO_ENABLE_EXTERNAL_SSO""); buildUser(externalSsoEnabled , params, authzName) { }",Why is this needed?
protected boolean updateSelection(IStructuredSelection selection) { if (!super.updateSelection(selection)) { return false; } final IResource[][] clipboardData = new IResource[1][]; shell.getDisplay().syncExec(new Runnable() { @Override public void run() { ResourceTransfer resTransfer = ResourceTransfer.getInstance(); clipboardData[0] = (IResource[]) clipboard.getContents(resTransfer); } }); IResource[] resourceData = clipboardData[0]; boolean isProjectRes = resourceData != null && resourceData.length > 0 && resourceData[0].getType() == IResource.PROJECT; if (isProjectRes) { for (IResource element : resourceData) { if (element.getType() != IResource.PROJECT || ((IProject) element).isOpen() == false) { return false; } } return true; } if (getSelectedNonResources().size() > 0) { return false; } IResource targetResource = getTarget(); if (targetResource == null) { return false; } List<? extends IResource> selectedResources = getSelectedResources(); if (selectedResources.size() > 1) { for (IResource resource : selectedResources) { if (resource.getType() != IResource.FILE) { return false; } if (!targetResource.equals(resource.getParent())) { return false; } } } if (resourceData != null) { if (isLinked(resourceData) && targetResource.getType() != IResource.PROJECT && targetResource.getType() != IResource.FOLDER) { return false; } if (targetResource.getType() == IResource.FOLDER) { for (IResource element : resourceData) { if (targetResource.equals(element)) { return false; } } } return true; } TransferData[] transfers = clipboard.getAvailableTypes(); FileTransfer fileTransfer = FileTransfer.getInstance(); for (TransferData transfer : transfers) { if (fileTransfer.isSupportedType(transfer)) { return true; } } return false; },rename 'resource',"I don't think one should convert the same monitor multiple times. Use SubMonitor progress = SubMonitor.convert(actMonitor, projectsToCreate.size() * 2 + 1); at the top and then use only progress, not actMonitor, and use progress.newChild(1) here and below.","Let's move ""_recognized_"" to final static variable",@chaviw no point checking for files being null here since you already call files.size() above.,"Could you describe why, not what?",This seems redundant.,All the above tests are already covered by the BaseComputeServiceLiveTest. You should subclass that one and try to make all tests pass without overriding its methods (as that is our compute service implementation contract). Take the [DigitalOcean](<LINK_0> one as an example.,"we don't use braces around single line blocks, many more occurrences in this patch",_== true_ part is not needed as booleanForKeyWithDefault already returns a boolean ;),Is that a software issue? Then better do WARN and include the exception as a last param.,Please rename to edgeId.
public void destroyTelephonyConference() { for (Connection c : getConnections()) { notifyConferenceMembershipChanged(c); } destroy(); },It doesn;t look like the membership of these connections have been changed yet.. Should removeTelephonyConnection be called for all of the connections first?,"emmmm i dont feel this replacement is necessary...and it might change what the code intends to do, as put will replace the value corresponding to the question even if the question is already associated with a value, but putIfAbsent only associate question with the new ArrayList<>() if the question is not associated to anything.",isn't finishing tied to joinPagesNotNeeded not being empty? Maybe just get rid of it and then then becomes return joinPagesNotNeeded.orElse(NOT_BLOCKED),We dont need size variable here.,Why not inline this variable?,Showing size here would help users to understand what's wrong since it's likely users don't know an actual number of tasks with step.,"Just a tiny thing, I guess we can move the condition to an assign statement, it could be easier to read since the conditional expression is quite complex now. int mutePreviewOverlayVisibility = showMuteOverlayOnVideoCall() && muteButton.isChecked() && !isInGreenScreenMode ? View.VISIBLE : View.GONE; mutePreviewOverlay.setVisibility(mutePreviewOverlayVisibility);",Does GSON maintain full method names or does it drop Java bean notation? I know in Jackson's case this would serialize as hotelName (possibly HotelName as I'm not completely certain about how it handles casing).,"Colon after ""used""",Is there a need to read the prop file for every request?,"configuration should be injected, not read from system properties in the constructor."
"private long getWatermarkMs(String realtimeTableName, List<LLCRealtimeSegmentZKMetadata> completedSegmentsMetadata, long bucketMs) { RealtimeToOfflineSegmentsTaskMetadata realtimeToOfflineSegmentsTaskMetadata = _clusterInfoAccessor.getMinionRealtimeToOfflineSegmentsTaskMetadata(realtimeTableName); if (realtimeToOfflineSegmentsTaskMetadata == null) { long watermarkMs; long minStartTimeMs = Long.MAX_VALUE; for (LLCRealtimeSegmentZKMetadata realtimeSegmentZKMetadata : completedSegmentsMetadata) { minStartTimeMs = Math.min(minStartTimeMs, realtimeSegmentZKMetadata.getStartTimeMs()); } watermarkMs = (minStartTimeMs / bucketMs) * bucketMs; realtimeToOfflineSegmentsTaskMetadata = new RealtimeToOfflineSegmentsTaskMetadata(realtimeTableName, watermarkMs); _clusterInfoAccessor.setRealtimeToOfflineSegmentsTaskMetadata(realtimeToOfflineSegmentsTaskMetadata); } return realtimeToOfflineSegmentsTaskMetadata.getWatermarkMs(); }",Do we want to add  Preconditions.checkState(minStartTimeMs != Long.MAX_VALUE);  to throw the exception at the same condition?,is it possible that getDruidNode() or getHostAndPortToUse() are null?,No need for code duplication. We can do something like:  StorageType storageType = mStorage.isExternal() ? StatFsHelper.StorageType.EXTERNAL : StatFsHelper.StorageType.INTERNAL;,"Could you change ""for("" to ""for (""? Other places too.","This is too aggressive :( The iterator is not released after a call ended because it might not be fully read. If I'm not wrong, setting it to null would cause infinite loop when result row count is large enough.","It would be nice to move this switch into SamComparisonMetric. Or, move it into AlignmentComparison so the switch is no longer necessary, e.g. AlignmentComparison.updateMetric(SamComparisonMetric), where updateMetric() is overridden per enum member to increment the correct field.",EnumMachineAlpha.STEAM_OVEN.getState()?,"this code block (if in L54-L59) can be encapsulated into a method to avoid duplicate in onJobFinished(), something like boolean tryExecute() that returns whether the job execution was successful",This leaves ActivityLauncher.newGalleryPost() unused - I think we should probably clean that up too.,Looks like getCMPath never throw IOException or MetaException. Shall check and remove it.,I think we need to maintain the backwards compatibility for the old skewl setSpeed . our new proper method is setVelocity which takes a double that specifies the angular velocity of the servo that we will try to achieve.
"private static void printTumorTypeSummary(Set<Evidence> evidences, SpreadsheetService service, WorksheetEntry entry) throws IOException, ServiceException { URL feedUrl = entry.getListFeedUrl(); if (evidences != null && service != null && entry != null) { for (Evidence evidence : evidences) { ListEntry row = new ListEntry(); setValue(row, ""Gene"", evidence.getGene().getHugoSymbol()); List<String> alterationNames = new ArrayList<>(); for (Alteration alteration : evidence.getAlterations()) { if (StringUtils.isNullOrEmpty(alteration.getName())) { alterationNames.add(alteration.getAlteration()); } else { alterationNames.add(alteration.getName()); } } setValue(row, ""Variants"", MainUtils.listToString(alterationNames, "", "")); setValue(row, ""CancerType"", getCancerType(evidence.getOncoTreeType())); setValue(row, ""Summary"", evidence.getDescription()); service.insert(feedUrl, row); } } }",Put this snippet of getting alterationNames into a function. Since the same code is used in printEvidences(),We need to check to check what happens with no value and some value snaks.,You could do this in the model itself because userGroup is already represented in model. getSlaveUserGroupName().setIsChangeable() can be used to make the ui-editor to enable or disable.,"@unyoungwax, oops missed this, but consider prefixing this boolean with <code>is...</code>",Should this be libDir.getAbsolutePath() like f..getAbsolutePath() above?,Style-nit: Unnecessary blank line.,you should use res.isWorseThan(Result.SUCCESS) instead. <LINK_0>,can just do if (StringUtils.isBlank(id)) { return; } to reduce nesting level,This string should go into the messages.properties file.,This leaves ActivityLauncher.newGalleryPost() unused - I think we should probably clean that up too.,Can we combine this case with the one above? if (selectionSet instanceof String || selectionSet instanceOf Number)
"public static void createProjects( final Set<ProjectRecord> projectsToCreate, final boolean open, final IWorkingSet[] selectedWorkingSets, IProgressMonitor monitor) throws InvocationTargetException, InterruptedException { IWorkspaceRunnable wsr = new IWorkspaceRunnable() { @Override public void run(IProgressMonitor actMonitor) throws CoreException { IWorkingSetManager workingSetManager = PlatformUI .getWorkbench().getWorkingSetManager(); try { actMonitor.beginTask("""", projectsToCreate.size() * 2 + 1); if (actMonitor.isCanceled()) throw new OperationCanceledException(); Map<IProject, File> projectsToConnect = new HashMap<>(); for (ProjectRecord projectRecord : projectsToCreate) { if (actMonitor.isCanceled()) throw new OperationCanceledException(); actMonitor.subTask(projectRecord.getProjectLabel()); IProject project = createExistingProject(projectRecord, open, SubMonitor.convert(actMonitor, 1)); if (project == null) continue; RepositoryFinder finder = new RepositoryFinder(project); finder.setFindInChildren(false); Collection<RepositoryMapping> mappings = finder .find(SubMonitor.convert(actMonitor, 1)); if (!mappings.isEmpty()) { RepositoryMapping mapping = mappings.iterator() .next(); IPath absolutePath = mapping .getGitDirAbsolutePath(); if (absolutePath != null) { projectsToConnect.put(project, absolutePath.toFile()); } } if (selectedWorkingSets != null && selectedWorkingSets.length > 0) workingSetManager.addToWorkingSets(project, selectedWorkingSets); } if (!projectsToConnect.isEmpty()) { ConnectProviderOperation connect = new ConnectProviderOperation( projectsToConnect); connect.execute(SubMonitor.convert(actMonitor, 1)); } } finally { actMonitor.done(); } } }; try { ResourcesPlugin.getWorkspace().run(wsr, monitor); } catch (OperationCanceledException e) { throw new InterruptedException(); } catch (CoreException e) { throw new InvocationTargetException(e); } }","I don't think one should convert the same monitor multiple times. Use SubMonitor progress = SubMonitor.convert(actMonitor, projectsToCreate.size() * 2 + 1); at the top and then use only progress, not actMonitor, and use progress.newChild(1) here and below.",Needs quotes around the msbuild command,one more progress monitor change,Should this be in an entitlement?,m,Can you create a constant for the -1? I'm not sure what that represents here.,"Let's move ""_recognized_"" to final static variable",@tadamski If you cache this FilePermission in the containing FileSystemXAResourceRecoveryRegistry object you will save a per-transaction objection creation/gc.,"Strange to use an XMIException here, which would imply something is corrupted at the XMI level, which is not the case. Especially since there is a AirdResourceVersionMismatchException defined in the same patch which implements Resource.Diagnostic.","Rather than iterate over the whole model twice, just use the Resource interface to nagivate through child resources once.","this code is very strange, can you explain to me because is necessary?"
