code,review,top_1,top_2,top_3,top_4,top_5,top_6,top_7,top_8,top_9,top_10
"@@ -989,8 +989,8 @@ define([ } var viewExtentCVCartographic = new Cartographic(); - var viewExtentCVNorthEast = Cartesian4.clone(Cartesian4.UNIT_W); - var viewExtentCVSouthWest = Cartesian4.clone(Cartesian4.UNIT_W); + var viewExtentCVNorthEast = new Cartesian3(); + var viewExtentCVSouthWest = new Cartesian3(); var viewExtentCVTransform = new Matrix4(); function extentCameraPositionColumbusView(camera, extent, projection, result, positionOnly) { var north = extent.north; ","You can remove these too. Below do: `var northEast = projection.project(cart, viewExtentCVNorthEast);` and remove `position`. Same thing for `southWest`.",Do you really need to mkdirs() here? I would think you just need `project.prepare()` which will make that target folder if necessary. Can you try that instead?,It is slightly cleaner to just pass `context` through and only access `context.webgl2` in `combineShader`. Also this lets us access any other properties of `context` in the future.,assign the guid to the annotation GUID on deserialize.,Please put the `Trim` inside `FoldToASCII`,`var typesToSubscribe = messageTypesHandled.Where(eventType => !requireExplicitRouting || publishers.GetPublisherFor(eventType).Any()).ToList();` this part needs to be changed.,"This configures Jackson to exclude `null`, `Optional.empty()` and empty collections when serializing.",Did something change with Lucene's support for wildcards? What's the behavior if you search with a wildcard at the beginning of your search?,shouldnt this be `$localStorage.authenticationToken` ? @cicoub13,"`#warn` won't give us the call stack, this has to be an `#error`.",Remove the cast
"@@ -79,4 +79,4 @@ foreach ($slas as $sla) { echo '</div>'; } -$pagetitle[] = 'SLAs'; +$pagetitle[] = 'SLAs'; \ No newline at end of file ","Oopsie, files should have a blank line at the end.",The `TopTags` at the beginning of the file is now unused and can be removed as well.,This will be removed.,We cannot know what the WHERE clause is for stream pull queries since it's not analyzed by the logical plan,Renaming this variable `arch` and flipping the values/logic in the surrounding code would make this a bit less confusing. Double negatives FTL where avoidable,@mdorier can you condition this on whether `self.run_tests` is `True`? by default it will be off. Otherwise I think the result may be unexpected given the python test dependency.,"common-min.js is is a generated file. It shouldn't be included here. In fact, it's generated from this list of files, so I'm surprised that this helps.","_I think_ this is the correct way to freeze this array, but I'm open to any suggestions to improve it (or fix it altogether if I'm not even close to how it should be   )",Please don't include general cleanup in otherwise unrelated files in your PR.,Remove the entire condition.,"we should avoid manual edits to the generated files, right?"
"@@ -705,8 +705,16 @@ get_object_layout(struct pl_jump_map *jmap, struct pl_obj_layout *layout, D_DEBUG(DB_PL, Target unavailable  DF_TARGET . Adding to remap_list: fail cnt %d\n, DP_TARGET(target), fail_tgt_cnt); - rc = remap_alloc_one(remap_list, k, target, - false); + + if (remap_grp_used == NULL) { + remap_grp_used = remap_gpu_alloc_one(&dgu_remap_list, + dom_cur_grp_used); + if (remap_grp_used == NULL) + D_GOTO(out, rc = -DER_NOMEM); + realloc_grp_used = true; + } + + rc = remap_alloc_one(remap_list, k, target, false, remap_grp_used); if (rc) D_GOTO(out, rc); ","It's really hard to follow this, why don't you just simply allocate per-RDG used domain bitmap for all groups at the very beginning (Just like what we did for other bitmaps)?",I'd recommend considering semantics that enforces the absolute path check only after prepending the include_dir. IMO it would be much more useful.,mismerge? this seems to be duplicate.,"sizeof() is number of bytes in memory, not number of characters in the string string += int is appending the character value of the integer","At line 331, you do `(string?)` and here you do `!`? Maybe both are fine, just something I noticed. Not sure if it needs to be changed.","wow, we must have other not compiled code hidden by conditional compilation.",Should this be configurable? i.e on by default but able to be turned off.. Should it be able to be disabled at compile time? I had to do similar things for #12745,"Instead of `vpm->purpose != X509_PURPOSE_SSL_SERVER` it would have to be `vpm->purpose == X509_PURPOSE_SSL_CLIENT`. Otherwise, this breaks `X509_PURPOSE_SMIME_SIGN` and possibly others.",This matches the pattern from the recent change to lib/Runtime/Library/BoundFunction.cpp,we should assert thet the error message is meaningful here,"This is only true for `hf_version >= HF_VERSION_2021_SCALING`, otherwise it is `min(Mb, 1.4*Ml)`."
"@@ -35,7 +35,7 @@ let PropertyRulesDef; */ const GLOBAL_PROPERTY_RULES = { 'class': { - blacklistedValueRegex: '(^|\\W)i-amphtml-', + denylistedValueRegex: '(^|\\W)i-amphtml-', }, 'hidden': null, 'text': null, ","/cc @choumx I can't tell if this value is actually exposed to publishers. If so, this isn't safe to change.","Why `@protected`? Why should this be overridden? Trailing underscore means `@private`, so would have to be removed.","There are methods in IUIContext, no?",This must be renamed as soon as LibraryUI introduces class with identical name `SearchCategory`.,"ouch sorry guys this is my bad, I didn't know how to do this in a portable way :/ Would you say this is a good solution?","Term `noteIndex` is little bit confusing for me. Since you are working on naming, how about changing it into `noteSearchService`?",@mjkkirschner is this an API break too?,"we should avoid manual edits to the generated files, right?","Perhaps instead of adding a new call for is_thrift, this could move to a different pattern. Maybe it could look for the class instead via isinstance. It looks like the deprecation plan for the associated `is_*` methods involved types via marker mixins.",Please change file name to `touch-handler`.,Please don't include general cleanup in otherwise unrelated files in your PR.
"@@ -178,9 +178,13 @@ class PickDropChannelsMixin(object): inst = self.copy() if copy else self idx = [inst.ch_names.index(c) for c in ch_names if c in inst.ch_names] + if hasattr(inst, 'picks'): inst.picks = [inst.picks[k] for k in idx] + if hasattr(inst, 'cals'): + inst.cals = inst.cals[idx] + inst.info = pick_info(inst.info, idx, copy=False) my_get = lambda attr: getattr(inst, attr, None) ",@agramfort I like this better since it's a separate issue from preloading. WDYT? cc @dengemann,"Let's throw a generic ``ConanException``. New exceptions will be introduced from now on, only if it is going to be captured and processed somewhere else. Let's keep it simple.","Could this be breaking? I think it shouldn't, the aggregated_components is used only by the new generators, and it makes sense that aggregating the components in a single cppinfo, keeps the root properties. The aggregation cannot be done for the component's properties because they cannot be aggregated but keeping the root one make sense. right?","If you remove `visit_mypy_file` from the class (I think that it's unused), this will be completely reasonable, since this will be reference to something outside the AST node we are transforming.","You'll also need to add this to `predict_entailment` in the model, I think.","Why not Optional? (Currently mypy ignores the None initialization but we may change that, and it seems to me this function can definitely return with `id_mapper` still None.",~~What's a repo import?~~ Got it.,"I can understand the sequence size being configurable when you're using the dummy decoder, but does it make sense to override it when using a real decoder? IMO, the code should only allow the `--seq` option to be set when `-m_de` is unspecified, and otherwise derive the sequence size from the decoder's input shape.",we never use np.testing outside of tests. Also shape are tuples so == works fine.,Would `elif x is None` work?,This will throw a warning since the `exclude` parameter is not set. Might be saner to do `exclude='bads'` then omit from the next line.
"@@ -52,9 +52,8 @@ class DataIterator: @classmethod def from_params(cls, params: Params): - from allennlp.experiments.registry import Registry # TODO(Mark): The adaptive iterator will need a bit of work here, # to retrieve the scaling function etc. - iterator_type = params.pop_choice(type, Registry.list_data_iterators()) - return Registry.get_data_iterator(iterator_type)(**params.as_dict()) # type: ignore + iterator_type = params.pop_choice(type, cls.list_available()) + return cls.by_name(iterator_type)(**params.as_dict()) # type: ignore ","Do we actually need the `# type: ignore` here? We don't have it in other places. Also, there is no listed return type for the method - maybe that's the reason there was a type failure?",use lower case? `Type` -> `type`,"For the record: this is a bit ugly, but it will turn into a cleaner and more proper `fs.get_file` when migrating dvcfs to fsspec.",We should probably fork the CentOS include into two as as well - the newest (CentOS 8) has Apache version 2.4.35 that supports TLS session tickets. We could probably just call the ancestor class with `centos-old` and `centos-current` prefixes.,"A problem with inserting new arguments is that it breaks backwards compatibility in cases where people call the function with non keyword arguments (`read_raw_kit(input_fname, mrk, elp, ...)`). Before making this change we should be sure that nobody is using this function in their scripts that way. Otherwise the safer alternative is to add new arguments at the end.","Perhaps instead of adding a new call for is_thrift, this could move to a different pattern. Maybe it could look for the class instead via isinstance. It looks like the deprecation plan for the associated `is_*` methods involved types via marker mixins.",I think this can be done via `get_language_info` `i18n` templatetag,I would consider deprecating this method to avoid having 2 (inconsistant) ways of computing the rank from raw data.,"Create a new `PipelineHelper` to do compile, which could inherited from `CollectiveHelper`. As `PipelineHelper` is specific for pipeline, it could be put into corresponding meta optimizer.",Why no type annotations here?,I'm not sure I like the name of this key here...
"@@ -429,6 +429,11 @@ static int def_load_bio(CONF *conf, BIO *in, long *line) if (!str_copy(conf, psection, &include, p)) goto err; + if (conf->flag_abspath && !ossl_is_absolute_path(include)) { + ERR_raise(ERR_LIB_CONF, CONF_R_RELATIVE_PATH); + goto err; + } + if (include_dir != NULL && !ossl_is_absolute_path(include)) { size_t newlen = strlen(include_dir) + strlen(include) + 2; ",I'd recommend considering semantics that enforces the absolute path check only after prepending the include_dir. IMO it would be much more useful.,"This is very dodgy. One alias to the HMAC signature algorithm and the test may randomly go **BAMF**, because you might end up with, oh I don't know, id-Hmac. This is a case where the application has more accurate knowledge than libcrypto, as it really has *all* the data it needs to know exactly what names it's asking for. It's quite a simple program after all...",Should this be configurable? i.e on by default but able to be turned off.. Should it be able to be disabled at compile time? I had to do similar things for #12745,"This is only true for `hf_version >= HF_VERSION_2021_SCALING`, otherwise it is `min(Mb, 1.4*Ml)`.","Instead of `vpm->purpose != X509_PURPOSE_SSL_SERVER` it would have to be `vpm->purpose == X509_PURPOSE_SSL_CLIENT`. Otherwise, this breaks `X509_PURPOSE_SMIME_SIGN` and possibly others.",mismerge? this seems to be duplicate.,seems this loop is a good canditate to be replaced with a for loop,"Is it redundant or any side-effect? As my understand, if the caller offer the @args parameter, then it needs to free the space (pointed by rec->rec_mmid) by itself. The @rec will be freed after ik_rec_free() returned. So whether reset the rec_mmid or not will not cause correctness issue, right?","sizeof() is number of bytes in memory, not number of characters in the string string += int is appending the character value of the integer",This matches the pattern from the recent change to lib/Runtime/Library/BoundFunction.cpp,"It's really hard to follow this, why don't you just simply allocate per-RDG used domain bitmap for all groups at the very beginning (Just like what we did for other bitmaps)?"
"@@ -83,9 +83,6 @@ func testAPIDeleteOAuth2Application(t *testing.T) { oldApp := models.AssertExistsAndLoadBean(t, &models.OAuth2Application{ UID: user.ID, Name: test-app-1, - RedirectURIs: []string{ - http://www.google.com, - }, }).(*models.OAuth2Application) urlStr := fmt.Sprintf(/api/v1/user/applications/oauth2/%d?token=%s, oldApp.ID, token) ",reason to remove this?,We could put this string in a central place somewhere so we can reference it in both places where it appears in the code here in this PR.,I assume that there's some hidden invariant here that `data.outputSteps[0]` is correct. Should we be asserting something about `step.Op` at this point? Would it make more sense to write the above as a range like we have for Create/Replace?,"Should we have utility functions that delineate which non-successful BuildPhases are set by the build pod (where it is *currently* just Failed) and which are set outside of the build pod (i.e. BuildPhaseError), in case those two lists change over time?",why doesn't this try calling t.getAdminPermission()?,I'm not in love with instantiating `challengeTLSProvider` & `challengeHTTPProvider` here.,What the heck is a LUT?  ,"If ProjectRequestTemplate is required, shouldn't you throw an error if it's absent?",I was intentional to return `storeID` instead of `peer` to avoid alloc too many IDs during replacement check.,"@rhatdan question, does the first docker here need to be capped?",@smarterclayton should this inform the routing config subdomain or leave that default as is?
"@@ -1,9 +1,16 @@ import logging +from dvc.exceptions import InvalidArgumentError + logger = logging.getLogger(__name__) def _update_import_on_remote(stage, remote, jobs): + if stage.is_repo_import: + raise InvalidArgumentError( + Can't update a repo import with --to-remote + ) + url = stage.deps[0].path_info.url stage.outs[0].hash_info = stage.repo.cloud.transfer( url, jobs=jobs, remote=remote, command=update ",~~What's a repo import?~~ Got it.,"For the record: this is a bit ugly, but it will turn into a cleaner and more proper `fs.get_file` when migrating dvcfs to fsspec.","Could this be breaking? I think it shouldn't, the aggregated_components is used only by the new generators, and it makes sense that aggregating the components in a single cppinfo, keeps the root properties. The aggregation cannot be done for the component's properties because they cannot be aggregated but keeping the root one make sense. right?",This will throw a warning since the `exclude` parameter is not set. Might be saner to do `exclude='bads'` then omit from the next line.,"So, this works, but we should take a look at how it is being used, and see whether it should be batched. The parsing will be memoized obviously, but each usage is O(N) in the number of targets in a directory.",You missed a space. Also you can use `f'strings'` if you want!,"If you remove `visit_mypy_file` from the class (I think that it's unused), this will be completely reasonable, since this will be reference to something outside the AST node we are transforming.",@agramfort I like this better since it's a separate issue from preloading. WDYT? cc @dengemann,This should really be a defined constant.,"Let's throw a generic ``ConanException``. New exceptions will be introduced from now on, only if it is going to be captured and processed somewhere else. Let's keep it simple.","Do you check path representation, when you print it? If I not mistaken, it will be printed like PosixPath('path')"
"@@ -175,12 +175,16 @@ func determineSeed(shoot *gardencorev1beta1.Shoot, seedLister gardencorelisters. return nil, err } - filteredSeeds, err := filterSeedsMatchingSeedSelector(cloudProfile, seedList) + seedsMatchingCloudProfileSelector, err := filterSeedsMatchingSeedSelector(seedList, cloudProfile.Spec.SeedSelector, CloudProfile) + if err != nil { + return nil, err + } + seedsMatchingShootSelector, err := filterSeedsMatchingSeedSelector(seedsMatchingCloudProfileSelector, shoot.Spec.SeedSelector, Shoot) if err != nil { return nil, err } - candidates, err := getCandidates(shoot, filteredSeeds, strategy) + candidates, err := getCandidates(shoot, seedsMatchingShootSelector, strategy) if err != nil { return nil, err } ","Hmm, this will yield an unhelpful message, if there are Seeds that are matching the `seedSelector` of the Shoot, but not the one of the CloudProfile. I.e. it will say none out of the <n> seeds has the matching labels required by seed selector of 'Shoot' although, all Seeds might actually match the Shoot's selector. Can you evaluate both selectors individually and then combine the filtered set of Seeds here to be able to give a more helpful error message?",I think a better place for this would be inside of `broadcaster#Start()`,we already implement `String` on proxyURL. No need to change that line.,not needed because it's not a pointer on a slice.,"@CecileRobertMichon do you have any thoughts on doing this override here? Is this preferable to the pattern we have currently, where we pass along upgrade context through the code flow and do upgrade-specific mutations during defaults enforcement?","@rhatdan question, does the first docker here need to be capped?",I was intentional to return `storeID` instead of `peer` to avoid alloc too many IDs during replacement check.,"- As discussed have added type `chef-server` but it subject to change. - At present, it's required to add validation for admin `key` only.",This sort of mistake might be best avoided by encapsulating this logic in one place,@smarterclayton should this inform the routing config subdomain or leave that default as is?,What the heck is a LUT?  
"@@ -741,7 +741,17 @@ static int check_id(X509_STORE_CTX *ctx) if (!check_id_error(ctx, X509_V_ERR_IP_ADDRESS_MISMATCH)) return 0; } - return 1; + + /* + * When verifying SSL server certificates, require that an + * identity be set for validating the certificate subject unless + * the X509_V_FLAG_ALLOW_NO_SUBJECT_CHECK flags is set instead. + */ + if (vpm->purpose != X509_PURPOSE_SSL_SERVER + || (vpm->flags & X509_V_FLAG_ALLOW_NO_SUBJECT_CHECK)) + return 1; + + return (vpm->hosts || vpm->email || vpm->ip); } static int check_trust(X509_STORE_CTX *ctx, int num_untrusted) ","Instead of `vpm->purpose != X509_PURPOSE_SSL_SERVER` it would have to be `vpm->purpose == X509_PURPOSE_SSL_CLIENT`. Otherwise, this breaks `X509_PURPOSE_SMIME_SIGN` and possibly others.",I'd recommend considering semantics that enforces the absolute path check only after prepending the include_dir. IMO it would be much more useful.,Should this be configurable? i.e on by default but able to be turned off.. Should it be able to be disabled at compile time? I had to do similar things for #12745,mismerge? this seems to be duplicate.,This should probably just create a mask and do a single comparison rather than loop over individual bits.,This matches the pattern from the recent change to lib/Runtime/Library/BoundFunction.cpp,idToken is used in getLogoutInformation method,"This is very dodgy. One alias to the HMAC signature algorithm and the test may randomly go **BAMF**, because you might end up with, oh I don't know, id-Hmac. This is a case where the application has more accurate knowledge than libcrypto, as it really has *all* the data it needs to know exactly what names it's asking for. It's quite a simple program after all...","sizeof() is number of bytes in memory, not number of characters in the string string += int is appending the character value of the integer",SHA1 is non FIPS_MODE here but in FIPS_MODE in rsa_aid.c. Why?,"It's really hard to follow this, why don't you just simply allocate per-RDG used domain bitmap for all groups at the very beginning (Just like what we did for other bitmaps)?"
"@@ -236,6 +236,7 @@ func (b *BleveIndexer) Search(keyword string, repoIDs []int64, limit, start int) for _, repoID := range repoIDs { repoQueriesP = append(repoQueriesP, numericEqualityQuery(repoID, RepoID)) } + index, _ := strconv.ParseInt(keyword, 10, 64) repoQueries := make([]query.Query, len(repoQueriesP)) for i, v := range repoQueriesP { repoQueries[i] = query.Query(v) ",Maybe keyword is a string?,I assume that there's some hidden invariant here that `data.outputSteps[0]` is correct. Should we be asserting something about `step.Op` at this point? Would it make more sense to write the above as a range like we have for Create/Replace?,"- As discussed have added type `chef-server` but it subject to change. - At present, it's required to add validation for admin `key` only.",I think a better place for this would be inside of `broadcaster#Start()`,I was intentional to return `storeID` instead of `peer` to avoid alloc too many IDs during replacement check.,nit: `firehoseLogHandler` vs. `firehoseMiddleware` looks like a naming inconsistency? (`log` is not used anywhere else).,"There's only one set of `mapByResourceAndAction` and `methodsInfo`, so they're no longer passed in, but retrieved in the introspection code.","Hmm, this will yield an unhelpful message, if there are Seeds that are matching the `seedSelector` of the Shoot, but not the one of the CloudProfile. I.e. it will say none out of the <n> seeds has the matching labels required by seed selector of 'Shoot' although, all Seeds might actually match the Shoot's selector. Can you evaluate both selectors individually and then combine the filtered set of Seeds here to be able to give a more helpful error message?",This log line was added by me. I think it won't hurt but it simplifies a debugging process.,can we renamed the field itself also to data? Otherwise we have inception below :-),What the heck is a LUT?  
"@@ -329,13 +329,10 @@ func (a *apiServer) upsertWorkersForPipeline(pipelineInfo *pps.PipelineInfo) err workerRc, err := rc.Get( ppsutil.PipelineRcName(pipelineInfo.Pipeline.Name, pipelineInfo.Version), metav1.GetOptions{}) - if err == nil { - if (workerRc.Spec.Template.Spec.Containers[0].Resources.Requests == nil) && *workerRc.Spec.Replicas == 1 { - parallelism = 1 - resourceRequests = nil - resourceLimits = nil - } + if err != nil { + log.Errorf(error from rc.Get: %v, err) } + // TODO figure out why the statement below runs even if there's an error // rc was made by a previous version of pachyderm so we delete it if workerRc.ObjectMeta.Labels[version] != version.PrettyVersion() { if err := a.deleteWorkersForPipeline(pipelineInfo); err != nil { ",Shouldn't we be returning the error if there is an error here? I noticed you have a todo below to find out why the statement below is running when there is an error.,why doesn't this try calling t.getAdminPermission()?,"There's only one set of `mapByResourceAndAction` and `methodsInfo`, so they're no longer passed in, but retrieved in the introspection code.",This log line was added by me. I think it won't hurt but it simplifies a debugging process.,not needed because it's not a pointer on a slice.,"I see, the provider-level region skips the field validation. May be add a mention about this here?",What the heck is a LUT?  ,"@CecileRobertMichon do you have any thoughts on doing this override here? Is this preferable to the pattern we have currently, where we pass along upgrade context through the code flow and do upgrade-specific mutations during defaults enforcement?",nit: `firehoseLogHandler` vs. `firehoseMiddleware` looks like a naming inconsistency? (`log` is not used anywhere else).,All or most of this deletion was related to generating the per-language API doc link for each object type.,pre-existing bug. We should split this function into `maybeStale` and `active` like in user_ek -- the `getServerMaxDeviceEK` is busted if the latest key is stale.
