code,review,top_1,top_2,top_3,top_4,top_5,top_6,top_7,top_8,top_9,top_10
"@@ -53,10 +53,11 @@ </ul> </dd> </dl> - <router-link tag=button type=submit - :to={name: '<%= jhiPrefixCapitalized %>User'} - class=btn btn-info> + <router-link custom v-slot={ navigate } + :to={name: '<%= jhiPrefixCapitalized %>User'}> + <button @click=navigate type=submit class=btn btn-info> <font-awesome-icon icon=arrow-left></font-awesome-icon>&nbsp;<span v-text=$t('entity.action.back')> Back</span> + </button> </router-link> </div> </div> ",Should it be really a `submit` button and not just a `button` (was already before the case)?,"/cc @choumx I can't tell if this value is actually exposed to publishers. If so, this isn't safe to change.",Here `id=modalThreadsMetrics` is not best reference for `aria-describedby`. `id=modalThreadsMetrics{{ thread.threadId }}` is unused. Maybe put `{{ thread.threadName }}` into `span` and give it id which includes `{{ thread.threadId }}` and in table use the same id in `aria-describedby` attribute?,"we should avoid manual edits to the generated files, right?",Remove the entire condition.,I would change this date to the actual date this will hit production.,"Unless there is a really good reason for this, I'd prefer using the condition : `!app.serviceDiscoveryType || app.applicationType === 'uaa'` -> so it will be specific to UAA and will not impact the other option as the other options works well with Kubernetes",why do you do this?,"since we know that the notes are going to be iterated upon in the following line, we can preload them, to avoid a second `SELECT count` that would instead happen with `.each`",I think this can be done via `get_language_info` `i18n` templatetag,here!!!! change to value: Constants::TAG_COLORS[0]
"@@ -33,7 +33,7 @@ class LinkTag < LiquidTagBase path.slice!(0) if path.starts_with?(/) # remove leading slash if present path.slice!(-1) if path.ends_with?(/) # remove trailing slash if present extracted_hash = Addressable::Template.new({username}/{slug}).extract(path)&.symbolize_keys - raise StandardError, The article you're looking for does not exist: {% link #{slug} %} unless extracted_hash + raise StandardError, The article you're looking for does not exist: #{slug} unless extracted_hash extracted_hash end ","I changed this error message because I feel the main piece of information is the link that was passed in, not the syntax for the liquid tag.","Let's throw a generic ``ConanException``. New exceptions will be introduced from now on, only if it is going to be captured and processed somewhere else. Let's keep it simple.",Trailing whitespace detected.,why do you do this?,"For the record: this is a bit ugly, but it will turn into a cleaner and more proper `fs.get_file` when migrating dvcfs to fsspec.","we call cities + towns . size a lot, maybe make a helper method on tiles","I don't know why we used to render `Reminder: You used`, but I took the liberty of lowercasing it because...grammar.",s/deprecate/kill/? It's not public API.,"so one thing to note is that avialble_hex should return an array of edges, what you have now is a boolean which is hacky and sort of works, but is not consistent with how this method is used elsewhere",Metrics/LineLength: Line is too long. [122/120],Isn't `admin` fabricated earlier?
"@@ -550,7 +550,8 @@ func GenerateRegionGuideFunc(enableLog bool) RegionGuideFunc { // Once flow has changed, will update the cache. // Because keys and bytes are strongly related, only bytes are judged. if region.GetRoundBytesWritten() != origin.GetRoundBytesWritten() || - region.GetRoundBytesRead() != origin.GetRoundBytesRead() { + region.GetRoundBytesRead() != origin.GetRoundBytesRead() || + region.flowRoundDivisor < origin.flowRoundDivisor { saveCache, needSync = true, true } ",Why can we skip sync when `divisor` becomes greater?,I assume that there's some hidden invariant here that `data.outputSteps[0]` is correct. Should we be asserting something about `step.Op` at this point? Would it make more sense to write the above as a range like we have for Create/Replace?,This log line was added by me. I think it won't hurt but it simplifies a debugging process.,What the heck is a LUT?  ,"I see, the provider-level region skips the field validation. May be add a mention about this here?",I was intentional to return `storeID` instead of `peer` to avoid alloc too many IDs during replacement check.,do you need to make change to ByteCodeGenerator::InitBlockScopedNonTemps ? #Resolved,"Should we have utility functions that delineate which non-successful BuildPhases are set by the build pod (where it is *currently* just Failed) and which are set outside of the build pod (i.e. BuildPhaseError), in case those two lists change over time?","Since we're always setting this to `true`, any reason not to make `true` the default, and change this to something like `SuppressStackOutputs`? Is there even a reason to make it conditional? Also, was it intentional that you only did this for the cloud backend? Why not local also? I really don't want to see us diverging in behavior here.",why doesn't this try calling t.getAdminPermission()?,Why do we also need this if we have a runtime override? Can't we just used that?
"@@ -56,6 +56,7 @@ public class FreeStyleProject extends Project<FreeStyleProject,FreeStyleBuild> i return FreeStyleBuild.class; } + @Override public DescriptorImpl getDescriptor() { return (DescriptorImpl)Jenkins.getInstance().getDescriptorOrDie(getClass()); } ",Please don't include general cleanup in otherwise unrelated files in your PR.,We cannot know what the WHERE clause is for stream pull queries since it's not analyzed by the logical plan,"I think it's better to have the different classes each have their own loggers, rather than having them all share the `Migrations.class` logger. By having different loggers, users can more easily filter logs and can also configure different log levels for the different loggers. I assume your motivation for switching to a shared logger was so that the execution time would be logged by the same logger as the other messages from the command execution itself? I don't have a great solution but one option could be to have each command implement a simple `getLogger()` method, which we can then call here.","Term `noteIndex` is little bit confusing for me. Since you are working on naming, how about changing it into `noteSearchService`?",@garyli1019 : Is this one of the places where we are missing the cleanup of resources ?,"There are methods in IUIContext, no?","/cc @choumx I can't tell if this value is actually exposed to publishers. If so, this isn't safe to change.",Can you describe this change?,This must be renamed as soon as LibraryUI introduces class with identical name `SearchCategory`.,"Perhaps instead of adding a new call for is_thrift, this could move to a different pattern. Maybe it could look for the class instead via isinstance. It looks like the deprecation plan for the associated `is_*` methods involved types via marker mixins.","we should avoid manual edits to the generated files, right?"
"@@ -47,8 +47,10 @@ final class PublishMercureUpdatesListener private $createdEntities; private $updatedEntities; private $deletedEntities; + private $requestStack; + private $formats; - public function __construct(ResourceClassResolverInterface $resourceClassResolver, IriConverterInterface $iriConverter, ResourceMetadataFactoryInterface $resourceMetadataFactory, SerializerInterface $serializer, MessageBusInterface $messageBus = null, callable $publisher = null, ExpressionLanguage $expressionLanguage = null) + public function __construct(ResourceClassResolverInterface $resourceClassResolver, IriConverterInterface $iriConverter, ResourceMetadataFactoryInterface $resourceMetadataFactory, SerializerInterface $serializer, MessageBusInterface $messageBus = null, callable $publisher = null, RequestStack $requestStack, array $formats, ExpressionLanguage $expressionLanguage = null) { if (null === $messageBus && null === $publisher) { throw new InvalidArgumentException('A message bus or a publisher must be provided.'); ","We shouldn't use request stack here, because it makes the feature not fully compliant with GraphQL, and create a hard dependency to Symfony (we want to support Laravel and maybe PSR-7 at some point).",I think that at least we should create an issue to be able to serialize Cursor without loading everything into memory at the same time.,"I can understand the sequence size being configurable when you're using the dummy decoder, but does it make sense to override it when using a real decoder? IMO, the code should only allow the `--seq` option to be set when `-m_de` is unspecified, and otherwise derive the sequence size from the decoder's input shape.",You could even have gone further by loading only once the quality profile because currently : - It's loaded by projectAssociationFinder.getProfileKey - It's loaded again by profileProjectOperations.addProject But that could be part of another refactoring,Is this required on every element? I'd rather trigger this only if we set / remove a hold.,Remnant of moving from `0.1` to `1.0`? Is this change required as part of moving to a new Closure Compiler or just convenient to make in this PR?,We could check for COMMIT_AT_LEAST_ONCE explicitly.,Where are the descriptions?  ,This cleanup should have gone in a separate commit.,FYI with instanceof you don't need a separate check for bool/object. It doesn't throw errors.,"We could keep this as `toImmutableList()`. Moving away from streams simply to pre-size the output list, in code that's already doing expensive RPC calls, is a hard sell from a code readability standpoint."
"@@ -22,7 +22,7 @@ namespace CoreNodeModels.Input [SupressImportIntoVM] [IsDesignScriptCompatible] [AlsoKnownAs(DSCoreNodesUI.Input.IntegerSlider)] - public class IntegerSlider : SliderBase<int> + public class IntegerSlider : SliderBase<long> { /// <summary> /// The NodeType property provides a name which maps to the ",@mjkkirschner is this an API break too?,"There are methods in IUIContext, no?",This must be renamed as soon as LibraryUI introduces class with identical name `SearchCategory`.,"Why `@protected`? Why should this be overridden? Trailing underscore means `@private`, so would have to be removed.","ouch sorry guys this is my bad, I didn't know how to do this in a portable way :/ Would you say this is a good solution?","Term `noteIndex` is little bit confusing for me. Since you are working on naming, how about changing it into `noteSearchService`?","Note that `GetPropertyName` is marked with `AggressiveInline` but `LookupProperty` is not (it used to be, but there became 4 references to it over time causing code bloat).","The name should be `register_layer`, it's more meaningful.",Any thoughts to inline this directly? I think that might be a bit more direct.,Confirmed the issue on SQ side.,"_I think_ this is the correct way to freeze this array, but I'm open to any suggestions to improve it (or fix it altogether if I'm not even close to how it should be   )"
"@@ -506,7 +506,7 @@ module.exports = class huobipro extends Exchange { return this.parseOHLCVs (response['data'], market, timeframe, since, limit); } - async loadAccounts (reload = false) { + async loadAccounts (reload = false, params = {}) { if (reload) { this.accounts = await this.fetchAccounts (); } else { ",Forgot to pass `params` to `fetchAccounts` here ),"Why `@protected`? Why should this be overridden? Trailing underscore means `@private`, so would have to be removed.",added: stop loop on exception,Interesting for #5907 So I will rename it from `System::redirectTo($url)` to `System::redirect($to = '');` :-),"`#warn` won't give us the call stack, this has to be an `#error`.","The `millis()` function should only return 0 before the timer starts, and then only once every 49 days. And of course, 0xFFFFFFFF + 1 is also 0.",Is there any change in the way the plugins consume handlebars3 now? Do plugin developers need to do any change? or are the plugins going to stop working because of that or trigger a 404 in the browser console?,"We still need the `null` check here, `null` won't be defaulted and `typeof null === 'object'`",Can we rename `AVRO_SCHEMA_FULL_NAME` to `DEFAULT_AVRO_SCHEMA_FULL_NAME` please?,Please put the `Trim` inside `FoldToASCII`,"Do either LocalName or NamespaceURI have side-effects, e.g. advancing the reader, throwing exceptions if something couldn't be parsed, etc.?"
"@@ -29,14 +29,14 @@ public interface TicketState { * @return the previous time used. */ - long getPreviousTimeUsed(); + ZonedDateTime getPreviousTimeUsed(); /** * Get the time the ticket was created. * * @return the creation time of the ticket. */ - long getCreationTime(); + ZonedDateTime getCreationTime(); /** * Authentication information from the ticket. This may be null. ",Don't think this will work with JPA ticket registries. We'll likely run into either schema or serialization issues. Let's keep this as long.,Why removing the `public` keyword?,"Term `noteIndex` is little bit confusing for me. Since you are working on naming, how about changing it into `noteSearchService`?","There are methods in IUIContext, no?","Why `@protected`? Why should this be overridden? Trailing underscore means `@private`, so would have to be removed.",Please don't include general cleanup in otherwise unrelated files in your PR.,This type had been incorrect,This must be renamed as soon as LibraryUI introduces class with identical name `SearchCategory`.,"this should also be done for other properties (conflicts, provides and replaces are also package links)",I would keep the `@return null|array` for other tooling than phpstan,@garyli1019 : Is this one of the places where we are missing the cleanup of resources ?
"@@ -59,7 +59,7 @@ export class IframeMessagingClient { /** * Send a postMessage to Host Window * @param {object} message The message to send. - * @private + * @protected */ messageHost_(message) { this.getHostWindow().postMessage/*OK*/(message, '*'); ","Why `@protected`? Why should this be overridden? Trailing underscore means `@private`, so would have to be removed.",Why removing the `public` keyword?,"`#warn` won't give us the call stack, this has to be an `#error`.",Interesting for #5907 So I will rename it from `System::redirectTo($url)` to `System::redirect($to = '');` :-),@mjkkirschner is this an API break too?,"There are methods in IUIContext, no?",Forgot to pass `params` to `fetchAccounts` here ),"Term `noteIndex` is little bit confusing for me. Since you are working on naming, how about changing it into `noteSearchService`?","The `millis()` function should only return 0 before the timer starts, and then only once every 49 days. And of course, 0xFFFFFFFF + 1 is also 0.",This must be renamed as soon as LibraryUI introduces class with identical name `SearchCategory`.,Do you really need to mkdirs() here? I would think you just need `project.prepare()` which will make that target folder if necessary. Can you try that instead?
"@@ -91,14 +91,12 @@ public class LogoutResourceIT { private WebTestClient webTestClient; <%_ } _%> - private OidcIdToken idToken; - @BeforeEach public void before() <% if (!reactive) { %>throws Exception <% } %>{ Map<String, Object> claims = new HashMap<>(); claims.put(groups, Collections.singletonList(ROLE_USER)); claims.put(sub, 123); - this.idToken = new OidcIdToken(ID_TOKEN, Instant.now(), Instant.now().plusSeconds(60), claims); + OidcIdToken idToken = new OidcIdToken(ID_TOKEN, Instant.now(), Instant.now().plusSeconds(60), claims); <%_ if (!reactive) { _%> SecurityContextHolder.getContext().setAuthentication(authenticationToken(idToken)); ",idToken is used in getLogoutInformation method,why is this required? the cache already contains the subject (via `Cache.withSubject()`),Is there any change in the way the plugins consume handlebars3 now? Do plugin developers need to do any change? or are the plugins going to stop working because of that or trigger a 404 in the browser console?,"it would be better if we give it a big enough initial size, such as `(int) (methods.size() / 0.75f) + 1`",Why does simply `withBasicApiToken(alice)` not work here? Does that user not exist until created here?,"sizeof() is number of bytes in memory, not number of characters in the string string += int is appending the character value of the integer",we should assert thet the error message is meaningful here,This matches the pattern from the recent change to lib/Runtime/Library/BoundFunction.cpp,What is unsafe about the two methods below? Can these suppressions (and thus the RUC on the ctor) be removed on this class?,"should `ServerSpanNaming.get()` context customizer be added here? I notice it's missing in some cases and included in others, but not clear to me why","Do either LocalName or NamespaceURI have side-effects, e.g. advancing the reader, throwing exceptions if something couldn't be parsed, etc.?"
"@@ -230,11 +230,13 @@ namespace System.Data #endregion #region IBindingList -// TODO: Enable after System.ComponentModel.TypeConverter is annotated + // TODO: Enable after System.ComponentModel.TypeConverter is annotated #nullable disable /// <summary> /// Clears both expression-based and DataView's string-based sorting. /// </summary> + [UnconditionalSuppressMessage(ReflectionAnalysis, IL2026:UnrecognizedReflectionPattern, + Justification = This whole class is unsafe. Constructors are marked as such.)] void IBindingList.RemoveSort() { base.Sort = string.Empty; ",What is unsafe about the two methods below? Can these suppressions (and thus the RUC on the ctor) be removed on this class?,I assume you're checking with XNA and these are cases where we missed having it serializable? Can you add `[DataContract]` to these as well if that is the case?,This matches the pattern from the recent change to lib/Runtime/Library/BoundFunction.cpp,Did something change with Lucene's support for wildcards? What's the behavior if you search with a wildcard at the beginning of your search?,"Note that `GetPropertyName` is marked with `AggressiveInline` but `LookupProperty` is not (it used to be, but there became 4 references to it over time causing code bloat).",Why does simply `withBasicApiToken(alice)` not work here? Does that user not exist until created here?,This is a change to public surface area. I would have expected the ref to also be updated with this.,we should assert thet the error message is meaningful here,"it would be better if we give it a big enough initial size, such as `(int) (methods.size() / 0.75f) + 1`",do you need to make change to ByteCodeGenerator::InitBlockScopedNonTemps ? #Resolved,idToken is used in getLogoutInformation method
"@@ -80,7 +80,7 @@ func commitCmd(c *cli.Context) error { case oci: mimeType = buildah.OCIv1ImageManifest if c.IsSet(message) { - return errors.Errorf(messages cannot be added to the OCIv1 image format.) + return errors.Errorf(messages are only compatible with the docker image format (-f docker)) } case docker: mimeType = buildah.Dockerv2ImageManifest ","@rhatdan question, does the first docker here need to be capped?",we already implement `String` on proxyURL. No need to change that line.,not needed because it's not a pointer on a slice.,"This had been non-fatal since #302, but I don't see any discussion there about why it was non-fatal then.","Hmm, this will yield an unhelpful message, if there are Seeds that are matching the `seedSelector` of the Shoot, but not the one of the CloudProfile. I.e. it will say none out of the <n> seeds has the matching labels required by seed selector of 'Shoot' although, all Seeds might actually match the Shoot's selector. Can you evaluate both selectors individually and then combine the filtered set of Seeds here to be able to give a more helpful error message?",I think a better place for this would be inside of `broadcaster#Start()`,"- As discussed have added type `chef-server` but it subject to change. - At present, it's required to add validation for admin `key` only.",What the heck is a LUT?  ,"I see, the provider-level region skips the field validation. May be add a mention about this here?",Would you mind adding something like Cortex doesn't directly use it (and should never use it) but this feature is used by other projects built on top of it..,@smarterclayton should this inform the routing config subdomain or leave that default as is?
"@@ -1850,9 +1850,10 @@ class BaseRaw(ProjMixin, ContainsMixin, UpdateChannelsMixin, SetChannelsMixin, show=show, block=block, n_jobs=n_jobs, axes=axes, verbose=verbose) - @fill_doc + @verbose def estimate_rank(self, tstart=0.0, tstop=30.0, tol=1e-4, - return_singular=False, picks=None, scalings='norm'): + return_singular=False, picks=None, scalings='norm', + verbose=None): Estimate rank of the raw data. This function is meant to provide a reasonable estimate of the rank. ",I would consider deprecating this method to avoid having 2 (inconsistant) ways of computing the rank from raw data.,"A problem with inserting new arguments is that it breaks backwards compatibility in cases where people call the function with non keyword arguments (`read_raw_kit(input_fname, mrk, elp, ...)`). Before making this change we should be sure that nobody is using this function in their scripts that way. Otherwise the safer alternative is to add new arguments at the end.",use lower case? `Type` -> `type`,"Do we actually need the `# type: ignore` here? We don't have it in other places. Also, there is no listed return type for the method - maybe that's the reason there was a type failure?",I'm not sure I like the name of this key here...,"For the record: this is a bit ugly, but it will turn into a cleaner and more proper `fs.get_file` when migrating dvcfs to fsspec.","Create a new `PipelineHelper` to do compile, which could inherited from `CollectiveHelper`. As `PipelineHelper` is specific for pipeline, it could be put into corresponding meta optimizer.","ouch sorry guys this is my bad, I didn't know how to do this in a portable way :/ Would you say this is a good solution?",fixes missing return in previous PR,  Interesting! I didn't know anything about this before. So this allows us to refresh an access token without the user needing to be present and authorize the refresh?,Why no type annotations here?
"@@ -94,6 +94,10 @@ class Server: self.options = options if os.path.isfile(STATUS_FILE): os.unlink(STATUS_FILE) + if self.fine_grained: + options.incremental = True + options.show_traceback = True + options.cache_dir = os.devnull def serve(self) -> None: Serve requests, synchronously (no thread or fork). ",Is this also going to be true for the real version of fine-grained?,"For the record: this is a bit ugly, but it will turn into a cleaner and more proper `fs.get_file` when migrating dvcfs to fsspec.",I think this can be done via `get_language_info` `i18n` templatetag,Who calls `cleanup_old_worker()`?. I am having some trouble finding it.,"You'll also need to add this to `predict_entailment` in the model, I think.","Why not Optional? (Currently mypy ignores the None initialization but we may change that, and it seems to me this function can definitely return with `id_mapper` still None.",Better to call this `paths_from_buildroot_iter()` (and below). `relative` is a vague term.,We should probably fork the CentOS include into two as as well - the newest (CentOS 8) has Apache version 2.4.35 that supports TLS session tickets. We could probably just call the ancestor class with `centos-old` and `centos-current` prefixes.,@garyli1019 : Is this one of the places where we are missing the cleanup of resources ?,I would consider deprecating this method to avoid having 2 (inconsistant) ways of computing the rank from raw data.,This type had been incorrect
