code,review,top_1,top_2,top_3,top_4,top_5,top_6,top_7,top_8,top_9,top_10
"@@ -101,9 +101,7 @@ func Execute(configFile io.Reader) { context.GetLogger(app).Fatalln(err) } } else { - tlsConf := &tls.Config{ - ClientAuth: tls.NoClientCert, - } + tlsConf := crypto.SecureTLSConfig(&tls.Config{ClientAuth: tls.NoClientCert}) if len(config.HTTP.TLS.ClientCAs) != 0 { pool := x509.NewCertPool() ",`crypto` module isn't imported.,we already implement `String` on proxyURL. No need to change that line.,I think a better place for this would be inside of `broadcaster#Start()`,not needed because it's not a pointer on a slice.,I think this is unnecessary and we should change many other places git command invokes and add an option on app.ini.,"Hmm, this will yield an unhelpful message, if there are Seeds that are matching the `seedSelector` of the Shoot, but not the one of the CloudProfile. I.e. it will say none out of the <n> seeds has the matching labels required by seed selector of 'Shoot' although, all Seeds might actually match the Shoot's selector. Can you evaluate both selectors individually and then combine the filtered set of Seeds here to be able to give a more helpful error message?",nit: `firehoseLogHandler` vs. `firehoseMiddleware` looks like a naming inconsistency? (`log` is not used anywhere else).,The migration runs in the background and does not prevent the ingest-service for starting fully while migrating the actions.,This sort of mistake might be best avoided by encapsulating this logic in one place,can we renamed the field itself also to data? Otherwise we have inception below :-),"This had been non-fatal since #302, but I don't see any discussion there about why it was non-fatal then."
"@@ -630,6 +630,10 @@ export class Resource { */ pause() { if (this.state_ == ResourceState.NOT_BUILT || this.paused_) { + if (this.paused_) { + dev.warn(TAG, 'pause() called on an already paused resource:', + this.debugid); + } return; } this.paused_ = true; ","`#warn` won't give us the call stack, this has to be an `#error`.","Why `@protected`? Why should this be overridden? Trailing underscore means `@private`, so would have to be removed.","This configures Jackson to exclude `null`, `Optional.empty()` and empty collections when serializing.",Interesting for #5907 So I will rename it from `System::redirectTo($url)` to `System::redirect($to = '');` :-),Do you really need to mkdirs() here? I would think you just need `project.prepare()` which will make that target folder if necessary. Can you try that instead?,Please put the `Trim` inside `FoldToASCII`,Can you describe this change?,"I would suggest to use pipelineCreationAllowed as the internal state name, it makes the code easier to read out as I I see. I know this is a regular getter and and setter pair, but... In the tests, the set method is always called with true as the parameter, so I suggest to call this method simply allowPipelineCreation() without a parameter, the getter part of the pair in this case can be called as isPipelineCreationAllowed(). This suggestion is simply about expressions from the usage point of view, and I don't have a strong opinion on this, however if we want to keep this name and want to name it as a regular getter setter as it is suggested by the books then we should use isAllowPipelineCreation as the getter name.","I think it's better to have the different classes each have their own loggers, rather than having them all share the `Migrations.class` logger. By having different loggers, users can more easily filter logs and can also configure different log levels for the different loggers. I assume your motivation for switching to a shared logger was so that the execution time would be logged by the same logger as the other messages from the command execution itself? I don't have a great solution but one option could be to have each command implement a simple `getLogger()` method, which we can then call here.",assign the guid to the annotation GUID on deserialize.,Whats going on here? `((X * Y)/Z) * Z` = `X * Y` is it not?
"@@ -268,7 +268,10 @@ func (t *Team) Rotate(ctx context.Context) error { memSet := newMemberSet() // create the team section of the signature - section, err := memSet.Section(t.Chain.GetID()) + + // TODO -- fill in a non-nil if we can't write/admin this chain explicitly and need + // admin permissions. See CORE-5501 + section, err := memSet.Section(t.Chain.GetID(), nil) if err != nil { return err } ",why doesn't this try calling t.getAdminPermission()?,Shouldn't we be returning the error if there is an error here? I noticed you have a todo below to find out why the statement below is running when there is an error.,not needed because it's not a pointer on a slice.,I assume that there's some hidden invariant here that `data.outputSteps[0]` is correct. Should we be asserting something about `step.Op` at this point? Would it make more sense to write the above as a range like we have for Create/Replace?,What the heck is a LUT?  ,"I see, the provider-level region skips the field validation. May be add a mention about this here?",I'm not in love with instantiating `challengeTLSProvider` & `challengeHTTPProvider` here.,nit: `firehoseLogHandler` vs. `firehoseMiddleware` looks like a naming inconsistency? (`log` is not used anywhere else).,All or most of this deletion was related to generating the per-language API doc link for each object type.,"@CecileRobertMichon do you have any thoughts on doing this override here? Is this preferable to the pattern we have currently, where we pass along upgrade context through the code flow and do upgrade-specific mutations during defaults enforcement?",This log line was added by me. I think it won't hurt but it simplifies a debugging process.
"@@ -32,13 +32,15 @@ const Routes = ({ match }) => ( <> <Switch> <%_ if (!readOnly) { _%> - <ErrorBoundaryRoute exact path={`${match.url}/:id/delete`} component={<%= entityReactName %>DeleteDialog} /> <ErrorBoundaryRoute exact path={`${match.url}/new`} component={<%= entityReactName %>Update} /> <ErrorBoundaryRoute exact path={`${match.url}/:id/edit`} component={<%= entityReactName %>Update} /> <%_ } _%> <ErrorBoundaryRoute exact path={`${match.url}/:id`} component={<%= entityReactName %>Detail} /> <ErrorBoundaryRoute path={match.url} component={<%= entityReactName %>} /> </Switch> + <%_ if (!readOnly) { _%> + <ErrorBoundaryRoute exact path={`${match.url}/:id/delete`} component={<%= entityReactName %>DeleteDialog} /> + <%_ } _%> </> ); ","not so sure about that one... if the point of having the deletion modal on top of the entity list page is what matters, then there may be a better way to achieve that","Unless there is a really good reason for this, I'd prefer using the condition : `!app.serviceDiscoveryType || app.applicationType === 'uaa'` -> so it will be specific to UAA and will not impact the other option as the other options works well with Kubernetes",Here `id=modalThreadsMetrics` is not best reference for `aria-describedby`. `id=modalThreadsMetrics{{ thread.threadId }}` is unused. Maybe put `{{ thread.threadName }}` into `span` and give it id which includes `{{ thread.threadId }}` and in table use the same id in `aria-describedby` attribute?,Is there any change in the way the plugins consume handlebars3 now? Do plugin developers need to do any change? or are the plugins going to stop working because of that or trigger a 404 in the browser console?,idToken is used in getLogoutInformation method,Please put the `Trim` inside `FoldToASCII`,shouldnt this be `$localStorage.authenticationToken` ? @cicoub13,I would change this date to the actual date this will hit production.,When implementing my own debug mode VS suggested; internal bool ExperimentalSearch { get; set; } = false;,Remove the entire condition.,here!!!! change to value: Constants::TAG_COLORS[0]
"@@ -17,6 +17,8 @@ package cluster import ( context + github.com/gogo/protobuf/proto + . github.com/pingcap/check github.com/pingcap/kvproto/pkg/metapb github.com/pingcap/kvproto/pkg/pdpb ",remove the empty line,You'll need another blank line after this to get the flake8 and isort checks to pass.,The `TopTags` at the beginning of the file is now unused and can be removed as well.,I think we should rename _module to _service ...,@mdorier can you condition this on whether `self.run_tests` is `True`? by default it will be off. Otherwise I think the result may be unexpected given the python test dependency.,@mjkkirschner is this an API break too?,"The name should be `register_layer`, it's more meaningful.","_I think_ this is the correct way to freeze this array, but I'm open to any suggestions to improve it (or fix it altogether if I'm not even close to how it should be   )",I vote to keep the splat/`*args`,This can't be imported here because it's defined in a type checking block. You'll need to redefine it in this file.,"Term `noteIndex` is little bit confusing for me. Since you are working on naming, how about changing it into `noteSearchService`?"
"@@ -51,7 +51,14 @@ public class LuceneCacheWarmer implements Runnable { for (final File indexDir : indexDirs) { final long indexStartNanos = System.nanoTime(); - final EventIndexSearcher eventSearcher = indexManager.borrowIndexSearcher(indexDir); + final EventIndexSearcher eventSearcher; + try { + eventSearcher = indexManager.borrowIndexSearcher(indexDir); + } catch (final FileNotFoundException fnfe) { + logger.debug(Cannot warm Lucene Index directory {} because the directory no longer exists, indexDir); + continue; + } + indexManager.returnIndexSearcher(eventSearcher); final long indexWarmMillis = TimeUnit.NANOSECONDS.toMillis(System.nanoTime() - indexStartNanos); ","Hi, What do you think of extracting this nested try to a separate method?","I would suggest to use pipelineCreationAllowed as the internal state name, it makes the code easier to read out as I I see. I know this is a regular getter and and setter pair, but... In the tests, the set method is always called with true as the parameter, so I suggest to call this method simply allowPipelineCreation() without a parameter, the getter part of the pair in this case can be called as isPipelineCreationAllowed(). This suggestion is simply about expressions from the usage point of view, and I don't have a strong opinion on this, however if we want to keep this name and want to name it as a regular getter setter as it is suggested by the books then we should use isAllowPipelineCreation as the getter name.",Why does simply `withBasicApiToken(alice)` not work here? Does that user not exist until created here?,This kind of `xxx - 1` calculation looks rare. Maybe we could get the same information from NetworkLocation? I'm also thinking is SegmentNames really needed.,Please also change the config property name in conf/aws/application.conf,Can you explain why this change is not present in master and 10.10?,"Why this change should be a part of this PR? cardinality < 0 probably means that completely different approach should be taken to compute topN, setting just to `Integer.MAX_VALUE` may result in a lot of excessive work and allocations in `run()` method.",a more elegant way to do this would be through a `getEngineContext()` method that reinits lazily,"it would be better if we give it a big enough initial size, such as `(int) (methods.size() / 0.75f) + 1`",shouldnt this be `$localStorage.authenticationToken` ? @cicoub13,Did something change with Lucene's support for wildcards? What's the behavior if you search with a wildcard at the beginning of your search?
"@@ -17,12 +17,17 @@ import com.google.inject.Binder; import com.google.inject.Module; import com.google.inject.Scopes; +import static io.airlift.configuration.ConfigBinder.configBinder; +import static org.weakref.jmx.guice.ExportBinder.newExporter; + public class EventListenerModule implements Module { @Override public void configure(Binder binder) { + configBinder(binder).bindConfig(EventListenerConfig.class); binder.bind(EventListenerManager.class).in(Scopes.SINGLETON); + newExporter(binder).export(EventListenerManager.class).withGeneratedName(); } } ",No need to add this since `EventListenerManager` doesn't have any `@Managed` annotations.,"There are methods in IUIContext, no?","I think it's better to have the different classes each have their own loggers, rather than having them all share the `Migrations.class` logger. By having different loggers, users can more easily filter logs and can also configure different log levels for the different loggers. I assume your motivation for switching to a shared logger was so that the execution time would be logged by the same logger as the other messages from the command execution itself? I don't have a great solution but one option could be to have each command implement a simple `getLogger()` method, which we can then call here.",Confirmed the issue on SQ side.,Why removing the `public` keyword?,"should `ServerSpanNaming.get()` context customizer be added here? I notice it's missing in some cases and included in others, but not clear to me why",Can we rename `AVRO_SCHEMA_FULL_NAME` to `DEFAULT_AVRO_SCHEMA_FULL_NAME` please?,"I would suggest to use pipelineCreationAllowed as the internal state name, it makes the code easier to read out as I I see. I know this is a regular getter and and setter pair, but... In the tests, the set method is always called with true as the parameter, so I suggest to call this method simply allowPipelineCreation() without a parameter, the getter part of the pair in this case can be called as isPipelineCreationAllowed(). This suggestion is simply about expressions from the usage point of view, and I don't have a strong opinion on this, however if we want to keep this name and want to name it as a regular getter setter as it is suggested by the books then we should use isAllowPipelineCreation as the getter name.",Remove the cast,a more elegant way to do this would be through a `getEngineContext()` method that reinits lazily,"`#warn` won't give us the call stack, this has to be an `#error`."
"@@ -133,6 +133,17 @@ func (ms *Status) Start() error { return nil } + exists, err = ms.hasActionData() + if err != nil { + ms.updateErr(err.Error(), Unable to detect migration status) + return err + } + if exists { + ms.update(Starting migration of actions to the event-feed-service) + go ms.migrateAction() + return nil + } + return nil } ",The migration runs in the background and does not prevent the ingest-service for starting fully while migrating the actions.,"This had been non-fatal since #302, but I don't see any discussion there about why it was non-fatal then.",we already implement `String` on proxyURL. No need to change that line.,I think a better place for this would be inside of `broadcaster#Start()`,"- As discussed have added type `chef-server` but it subject to change. - At present, it's required to add validation for admin `key` only.",This sort of mistake might be best avoided by encapsulating this logic in one place,"Hmm, this will yield an unhelpful message, if there are Seeds that are matching the `seedSelector` of the Shoot, but not the one of the CloudProfile. I.e. it will say none out of the <n> seeds has the matching labels required by seed selector of 'Shoot' although, all Seeds might actually match the Shoot's selector. Can you evaluate both selectors individually and then combine the filtered set of Seeds here to be able to give a more helpful error message?",I think this is unnecessary and we should change many other places git command invokes and add an option on app.ini.,"@rhatdan question, does the first docker here need to be capped?",`crypto` module isn't imported.,nit: `firehoseLogHandler` vs. `firehoseMiddleware` looks like a naming inconsistency? (`log` is not used anywhere else).
"@@ -112,6 +112,15 @@ public abstract class HttpClientTracer<REQUEST, CARRIER, RESPONSE> extends BaseT super.endExceptionally(span, throwable, -1); } + /** Convenience method primarily for bytecode instrumentation. */ + public void endMaybeExceptionally(Context context, RESPONSE response, Throwable throwable) { + if (throwable != null) { + endExceptionally(context, throwable); + } else { + end(context, response); + } + } + private Span internalStartSpan( Context parentContext, REQUEST request, String name, long startTimeNanos) { SpanBuilder spanBuilder = ","I'd put this method in a PR with at least one usage of it - inClientSpan / withClientSpan are quite clear here, but not this method which isn't used. One way to keep PRs small is to change just one usage in one PR, and remaining usages in a mechanical way in another.","What type is `NumberHandling`? Isn't it an enum value, how can it be null?",I think that at least we should create an issue to be able to serialize Cursor without loading everything into memory at the same time.,"I would suggest to use pipelineCreationAllowed as the internal state name, it makes the code easier to read out as I I see. I know this is a regular getter and and setter pair, but... In the tests, the set method is always called with true as the parameter, so I suggest to call this method simply allowPipelineCreation() without a parameter, the getter part of the pair in this case can be called as isPipelineCreationAllowed(). This suggestion is simply about expressions from the usage point of view, and I don't have a strong opinion on this, however if we want to keep this name and want to name it as a regular getter setter as it is suggested by the books then we should use isAllowPipelineCreation as the getter name.",We could check for COMMIT_AT_LEAST_ONCE explicitly.,"This configures Jackson to exclude `null`, `Optional.empty()` and empty collections when serializing.",Optional style: I'd put the text in the description bellow without defining a variable for it.,a more elegant way to do this would be through a `getEngineContext()` method that reinits lazily,Or remove status :-),Can you explain why this change is not present in master and 10.10?,Is this required on every element? I'd rather trigger this only if we set / remove a hold.
"@@ -48,10 +48,10 @@ namespace System.Text.Json.Serialization.Converters // Read method would have thrown if otherwise. Debug.Assert(tokenType == JsonTokenType.PropertyName); + ReadOnlySpan<byte> unescapedPropertyName = JsonSerializer.GetPropertyName(ref state, ref reader, options); JsonPropertyInfo jsonPropertyInfo = JsonSerializer.LookupProperty( obj, - ref reader, - options, + unescapedPropertyName, ref state, out bool useExtensionProperty); ","Note that `GetPropertyName` is marked with `AggressiveInline` but `LookupProperty` is not (it used to be, but there became 4 references to it over time causing code bloat).","What type is `NumberHandling`? Isn't it an enum value, how can it be null?",This matches the pattern from the recent change to lib/Runtime/Library/BoundFunction.cpp,"Do either LocalName or NamespaceURI have side-effects, e.g. advancing the reader, throwing exceptions if something couldn't be parsed, etc.?",Please put the `Trim` inside `FoldToASCII`,"This will be created regardless of migration actually happening, can we `new` only in `SettingsMigrationEventArgs.EventStatusType.Begin`?",Do you really need to mkdirs() here? I would think you just need `project.prepare()` which will make that target folder if necessary. Can you try that instead?,why is this required? the cache already contains the subject (via `Cache.withSubject()`),"This is only true for `hf_version >= HF_VERSION_2021_SCALING`, otherwise it is `min(Mb, 1.4*Ml)`.",Not to be confused with `hudson.util.FormValidation.Kind`.,we should assert thet the error message is meaningful here
"@@ -27,6 +27,7 @@ return array( 'logout' => Log out, 'logoutok' => You have been logged out., 'logouterror' => We couldn't log you out. Please try again., + 'session_expired' => Your session has expired. Please reload the page to log in., 'loggedinrequired' => You must be logged in to view the requested page., 'adminrequired' => You must be an administrator to view the requested page., ",Reloading the page won't always prompt for login.,Avoid variables with short names like $b. Configured minimum length is 3.,Isn't `admin` fabricated earlier?,replaced with `email_link` because this is a HTML template,  Interesting! I didn't know anything about this before. So this allows us to refresh an access token without the user needing to be present and authorize the refresh?,Is this also going to be true for the real version of fine-grained?,We could live with this maybe... although I expect XNA does set it. I wonder how many people have as a hack assumed they could fetch the graphics device via `VertexDeclaration.GraphicsDevice`.,"Here the same, I would make separate methods `check_leave_team_permission` and `check_manage_user_team_permission`.",I think this can be done via `get_language_info` `i18n` templatetag,Prefer double-quoted strings unless you need single quotes to avoid extra backslashes for escaping.,"`#warn` won't give us the call stack, this has to be an `#error`."
"@@ -117,8 +117,6 @@ class Collection(ModelBase): objects = CollectionManager() - top_tags = TopTags() - class Meta(ModelBase.Meta): db_table = 'collections' unique_together = (('author', 'slug'),) ",The `TopTags` at the beginning of the file is now unused and can be removed as well.,"Oopsie, files should have a blank line at the end.",TIL! Assume this is shorthand for `Time.zone.now..7.days.ago`?,"This line doesn't actually do anything, because you're just importing a submodule into a place it was already accessible. Before this line, I could do `from allennlp.semparse.contexts import atis_tables` in code outside of `semparse`, and this line lets me do exactly the same thing. In contrast, the line above takes something that was only accessible in a submodule and makes it accessible here. So before, you had to do `from allennlp.semparse.contexts.table_question_knowledge_graph import TableQuestionKnowledgeGraph`, and after, you can do `from allennlp.semparse.contexts import TableQuestionKnowledgeGraph`.",We cannot know what the WHERE clause is for stream pull queries since it's not analyzed by the logical plan,"This service supports updating tags via the `TagResource` and `UntagResource` API calls, which means it can be added to `aws/internal/keyvaluetags/generators/updatetags/main.go` as well for completeness. Will add its service entry and generate the new update function on merge.",@mdorier can you condition this on whether `self.run_tests` is `True`? by default it will be off. Otherwise I think the result may be unexpected given the python test dependency.,"we should avoid manual edits to the generated files, right?","_I think_ this is the correct way to freeze this array, but I'm open to any suggestions to improve it (or fix it altogether if I'm not even close to how it should be   )",change to string to avoid rubocop violation or disable cop locally since it's phone number  ,"Perhaps instead of adding a new call for is_thrift, this could move to a different pattern. Maybe it could look for the class instead via isinstance. It looks like the deprecation plan for the associated `is_*` methods involved types via marker mixins."
"@@ -179,6 +179,12 @@ $array = array('rowid' => 'ID', 'ref' => 'Ref', 'label' => 'Label', 'datec' => ' print $form->selectarray('TAKEPOS_SORTPRODUCTFIELD', $array, (empty($conf->global->TAKEPOS_SORTPRODUCTFIELD) ? 'rowid' : $conf->global->TAKEPOS_SORTPRODUCTFIELD), 0, 0, 0, '', 1); print </td></tr>\n; +print '<tr class=oddeven><td>'; +print $langs->trans('TakeposGroupSameProduct'); +print '<td colspan=2>'; +print ajax_constantonoff(TAKEPOS_GROUP_SAME_PRODUCT, array(), $conf->entity, 0, 0, 1, 0); +print </td></tr>\n; + $substitutionarray = pdf_getSubstitutionArray($langs, null, null, 2); $substitutionarray['__(AnyTranslationKey)__'] = $langs->trans(Translation); $htmltext = '<i>'.$langs->trans(AvailableVariables).':<br>'; ","If you use (and we should from v12) the new feature forcereload (param 1 at position 6), it means clicking on image is enough to switch. This also means you don't have to make the $res = dolibarr_set_const($db, 'TAKEPOS_GROUP_SAME_PRODUCT', ... when you click on save button or you will erase the setup","Without being able to reproduce this, this is likely enough. Ideally, if we can run this code on an impacted site and confirm it isn't the `$plugins` that is a problematic. (I don't see how, but I don't trust myself).","Since you're editing that line, could you add a space after the `!` to make it super clean?",Please put the `Trim` inside `FoldToASCII`,Is this the group we wanted enabled by default?,"why is this required, register will still work as normal link??",Did something change with Lucene's support for wildcards? What's the behavior if you search with a wildcard at the beginning of your search?,FYI with instanceof you don't need a separate check for bool/object. It doesn't throw errors.,"Do either LocalName or NamespaceURI have side-effects, e.g. advancing the reader, throwing exceptions if something couldn't be parsed, etc.?",Why do we intentionally discard the net price here?,shouldnt this be `$localStorage.authenticationToken` ? @cicoub13
